,score,comment
2240,1,업비트 사용하려고 케이뱅크 계좌 필요한 건데 본인인증 통신사 kt 알뜰폰 사용하는데 인증에서 하루 온종일 안되고 재요청 눌러도 소용없고 인증서로 인증할 랬더니 계속 영상통화해야 한 데서 25명 대기한 데서 23시간 기다도 11명 몇 시간 기다리다가 통화돼도 본인 명의 아닌 인증서라서 그런 거라고 완전 답답
2241,1,왜 전화되는 탭 사용자는 안 되나요 다른 금융권 다 깔아지는데 유일하게 못 까는 게 케이뱅크네요 이유가 없니까 이 앱 하나 다운로드하자고 폰을 새로 사야 되나요  해결해주세요 그리고 홈피 들어가 봐도 알 길이 없군요 금융 관련된 게 이렇게 허접해서야 업비트 때문에 어쩔 수 없이 써야 하지만 별 하나도 아깝습니다
2248,2,신분증 인증이 안돼서 담당자가 확인해야 한다고 떠요  처리 좀 해주세요
2257,1,이어서 계좌 만들기가 안돼요 하게 해주세요
2278,4,버그 제보할게요 전 이체를 하루에 최소 5건을 하는데요 몇백일 쓰다가 갑자기 3일 전부터 서버 통신이 너무 느려졌습니다 매 스텝마다 30초 이상 걸리니 짜증 나던 군요 설정  애플리케이션  케이뱅크  데이터 삭제하니까 재실행하니 바로 빨라졌습니다 다만 인증들을 다시 처음부터 해야 하기 때문에 좀 귀찮습니다 다른 분들도 참고하시고 개발자에게도 버그 수정 부탁드립니다
2280,1,휴대전화 번호를 인식할 수 없다고 메시지가 떠요 계좌는 웹에서 만들었는데 어플로는 계좌를 손댈 수가 없어요 유심을 재 장착하라 그러는데 kt 알뜰폰에서 유심을 구매해서 사용하는 건데 그게 문제가 되는 건가요 국내에서 구매한 건데 문제 해결 좀 해주세요
2294,4,세계 많은 지역이 송금 불가능하네요 다른 국가들도 해외송금했으면 좋겠네요
2296,1,이야 UI 느린 거는 말할 필요도 없고 지웠다가 다시 깔려는데 설치도 안되네요 은행 맞나요
2302,4,계좌번호 복사한 거 붙여넣기가 안되네요 굉장히 불편해요 저번에는 잘 사용했는데 업데이트 과정에서 기능이 빠진 것 같은데요 빨리 수정 부탁해요
2304,1,장난합니까 주거래은행 하려고 어플 깔고 전 재산 다 넣어뒀는데 어플 실행해서 페이지 오류 계속 뜨고 어플 개선 의지 하나도 없고 카카오뱅크처럼 ui 만들어서 프로그램화하려고 안 하고 그냥 웹 방식 쓰레기 만들어서 이게 발전이 있겠음
2308,1,어플이 열리지 않아요 s10 고요 거의 한 달 내리 이런데 개선 좀 해 주세요
2349,1,지점이 없어서 너무 불편하고 전화로 항상 상담해야 하는데 최악임 이율 빼곤 좋은 게 하나도 없는 은행 고객이 너무 넘쳐나서 더 이상 가입해줄 사람은 필요 없는 걸로 밖에 안 보이는 태도임
