,score,comment
2800,4,좋아요 편하게 잔액조회할 수 있고 타 은행 잔액도 알 수 있고 그런데 체크카드 후불교통카드 이용내역을 알 수 있게 해줬으면 좋겠어요 이용내역을 알 수 없어서 별 하나 차감이에요
2805,4,앱에서 가입할 수 있는 금융상품이 좀 더 다양했으면 좋겠습니다
2806,3,더 간소화될 필요가 있습니다 그리고 이체 화면으로 넘어갈 때 이체은행을 누르면 리스트들이 바로 보이지 않는 오류가 있어서 불편합니다
2809,4,속도 개선됐으면 하고 포인트 캐시백 이벤트 자주 해주세요
2815,4,느려짐 없고 기능이 간편하지만 더 다양한 앱 기능 서비스와 혜택을 제공해주면 좋을 것 같다고 생각합니다
2818,4,주거래은행이에요 여러 은행 사용하지만 KB 스타뱅킹이 제일 사용하기 편리한 거 같아요 메뉴의 구성이나 화면의 조화 같은 것들이요  앞으로도 지속적인 업데이트 부탁드립니다
2820,4,직관적인 인터페이스가 편리합니다 가끔 텍스트가 너무 많다는 느낌이 들기도 합니다 이벤트 응모 및 확인 기능이 추가되면 좋겠습니다
2823,3,계좌 입출금 시 앱 푸시가 왔으면 좋겠어요 알림만을 위해 다른 어플을 깔아야 하다니 이건 너무하지 않나요 다른 모든 어플에서는 문제없는데 지문인식이 되지 않거나 등록되지 않은 지문이라고 뜰 때가 많았어요 이렇게 되면 kb 다른 어플들 지문도 다 꼬이고 성나서 지문인증 안 썼었는데 이제 해소됐는지 모르겠네요
2829,4,주거래 은행이라 예전부터 잘 사용하고 있습니다 다만 KB국민은행 KB 국민카드 리브 메이트 리브 등등 너무 어플을 나눠놔서 기능에 맞게 앱 통합이 적절히 이루어졌으면 좋겠습니다
2833,4,KB 스타뱅킹 앱은 보안이 철저한 것이 장점이자 단점이다 이체를 하는 경우 간편등록번호로 로그인하면 인증서로 다시 로그인하고 전화번호로 신분확인 OTP로 확인하고 다시 인증서로 마지막 확인을 해야 한다 제발 확인을 간단하게 할 수 있게 해주시면 감사하겠습니다
2843,4,이체나 계좌 확인 등의 업무는 빠르고 간편해서 좋아요 다만 자동이체 등의 관련 자주 쓰는 메뉴는 메인화면에 즐겨찾기로 등록할 수 있게 하면 더 좋을 것 같습니다
2849,4,쓰기 좋아서 타 은행보다 더 애용 중입니다 하나 아쉬운 게 있다면 좀 더 자세한 계좌 설명이 있으면 좋을 것 같습니다
2859,4,다양한 로그인 방식으로 편리하게 사용 중입니다 오픈뱅킹으로 다른 금융의 입출금 자산현황을 한눈에 볼 수 있어 좋습니다 주거래은행이라 자주 사용하는데 kb 관련 앱이 너무 많습니다 통합하는 것도 좋을 거 같습니다
2862,3,어플 통합 좀 했으면 좋겠습니다 kb만 3개 쓰고 있어요
2863,4,UI가 좀 더 깔끔했으면 좋겠어요
2864,4,사용성 등 예전보다는 개선이 된듯하네요 그래도 속도는 좀 느리네요 이 부분만 개선되었으면 합니다
2866,4,장점 다양한 로그인 방법 등록된 계좌의 간편 계좌이체 단점 kb금융인 증서 금융 인증서 무슨 차이 혜택이 무엇인지 kb 관련 여러 앱 사용보다 하나로 통합 필요
2871,4,주거래은행이라 너무 잘 쓰고 있는데요 타 은행들은 뱅킹 어플 자체적으로 입출금 내역 알림이 오는데 Kb는 알림 어플을 따로 꼭 깔아야 해서 너무 불편해요 어플 없이 사용할 수 있도록 이 부분 꼭 개선 좀 해주세요
2874,1,첨에 잘 되더니 동전만 띄우고 엄청 늦어서 돌 지경이다 개선이 필요하다
2881,3,이체할 때 이체 정보가 다시 적용되면 좋겠습니다 한번 이체하고 다시 이체하면 기존 이체 계좌가 적용 안됩니다
2889,4,입출금 푸시 알림 있었으면 좋겠어요
2894,4,다른 은행 주거래 이용하다 kb로 바꾼 지 10년 되어 가네요 앱으로 은행 업무 편리하게 잘하고 있고 지금은 다른 은행 계좌까지 조회되고 타행계좌 조회해서 송금도 되니까 다른 은행 어플 지우고도 불편함 없이 사용하고 있네요 메뉴 화면 보기 편하고 오류 없어서 좋아요 리브 메이트는 사용하면 입출금 문자가 자동으로 와서 편했는데 저장공간 문제로 지웠더니 입출금 문자가 안 와서 불편하네요 추가 어플 없이 기능 있으면 좋겠어요
2896,4,사용 긴 편하고 좋아요 최근 이체 내역에 송금자송금메모 이름도 있으면 좋겠어요
2897,4,주요은행으로 요긴하게 잘 쓰고 있어요 계속 잘 운영해줬으면 좋겠습니다
2898,4,10년 넘게 주거래은행으로 이용하고 있는 kb국민은행 앞으로도 더 이용하기 쉽고 많은 혜택이 생겼으면 좋겠네요
2900,4,만족입니다 앞으로 업데이트 잘 해주세요
2901,4,같은 항목이 여기저기 있어요 비슷한 사이트 연결도 그렇고요 최대한 심플하게 구성해주세요
2905,4,공인인증서 선택 시 너무 많은 인증서가 한 번에 나타나는데 조금 줄여주었으면 좋겠습니다
2908,3,시원시원하게 보여서 좋습니다 자신이 편하게 즐겨찾기 커스터마이징 가능한 부분도 좋은데 나이 든 사람을 위해 글자 좀 크게 해주세요
2909,4,앱이 쓰기 좋아졌습니다 메뉴도 단순해져서 찾기 쉬워요 아쉬운 건 kb 관련 앱의 종류가 너무 많다는 겁니다 두 개 정도로 통일해 줬으면 좋겠습니다
2910,3,계좌조회 등 일부 불필요한 단계 및 화면 구성이 아쉬움
2921,4,채팅상담이 상담사가 해주면 좋겠어요 너무 불편해요
2926,3,접속 시 인증방법을 간편하게 해주면 좋겠어요 인증서 말고 패턴이나 비밀번호 같은 걸로요 그리고 송금 시 보안카드 비밀번호 입력도 간소화되면 합니다 안전을 위한 것이겠지만 요즘 다른 매체들 페이나 토스를 사용하면 좀 더 편리하더라고요
2930,4,실행 및 이용 시 타은행에 비해 편의성 및 실행 속도가 빠른 편입니다 더욱더 나은 서비스를 위해 최선을 다해주세요
2931,4,이벤트도 많고 사용하기에 좋아요 그런데 요즘은 이벤트가 전에 비해 줄어든 듯 앞으로도 많은 이벤트와 꾸준한 개선 부탁드려요
2939,4,다른 은행 앱처럼 스타뱅킹 자체로 입출금 알림 기능이 있었으면 좋겠어요
2942,4,종종 인증서 로그인이 잘 안되는 경우가 있어요 그리고 카드와 기타 기능들을 통합으로 사용할 수 있는 앱이 만들어지면 더 적극적으로 다양하게 사용할 수 있을 것 같은데 다 개별적으로 운영이 돼서 좀 아쉬운 마음이 있습니다 많은 사람들이 더 쉽고 다양하게 사용할 수 있도록 해주세요 
2948,4,평상시 자주 사용하고 있어요 그런데 약간의 불편함이 있어서 리뷰 남겨요 1로그인할 때 좀 더 간단한 방식이었으면 좋겠어요 예를 들면 비빌 번호 한 가지만으로 가능했으면 합니다 급할 때는 좀 번 거로 더러 고요 2조 회할 때 자꾸 여러 경로로 들어가야 하던데 이것도 좀 한 번에 할 수 있었으면 합니다 3고객들을 위한 이벤트가 좀 더 다양하고 많아졌으면 좋겠어 요소 학행을 누릴 수 있게 해주세요 감사합니다
2951,4,KB 앱 좀 통합했으면 좋겠습니다 많아도 너무 많아요
2960,3,국민은행은 앱 개선 및 통합에 좀 더 노력해주세요
2962,4,나의 금융비서 항상 내 지갑을 관리해줘요
2966,4,주거래 은행을 kb로 사용 중입니다 대체적으로 사용하기에 편리합니다만 조금 더 직관적인 사용이 가능하도록 개선해주시면 감사하겠습니다
2969,4,로그인 방식이 여러 가지이고 자주 쓰는 계좌 등록 등 간편하고 좋네요 다만 로그인할 때 로그인하고 다음 화면으로 넘어갈 때 매끄럽지 못하다는 생각이 들어요 버퍼링 난 것처럼 버벅대는 것만 수정해주세요
2970,4,잘 사용하고 있는데 너무 어플이 많아요 한 어플로 여러 기능 모아주시면 좋을 것 같아요
2972,4,로딩 속도 메뉴 이동 속도는 예전에 비해 많이 향상되었지만 아직도 답답한 감이 있어 개선이 요구됩니다 또 메뉴 중에 depth를 좀 줄였으면 하는 것들이 있습니다 그래도 타 은행 앱에 비해 좋은 점은 이체메뉴가 편리한 점입니다
2980,4,국민이 주거래은행이라 자주 사용하는데 이벤트 안내가 더 잘 보이는 곳에 있으면 좋겠어요 입출금도 수수료 면제 면 좋을 것 같아요
2983,4,전반적으로 크게 불편한 점은 없으나 다른 은행 앱에 비해 메뉴 전환 등 이동 시 다소 느린 편입니다 첫 화면에서 한눈에 자산 내역을 모두 볼 수 있는 점은 좋습니다 앱에서 이벤트가 자주 있어서 자주 접속하게 되는 점도 좋습니다 조금만 속도를 빠르게 해주시면 사용이 훨씬 편리할 것 같네요
2985,2,로그인 로딩이 너무 길어서 계좌에 안 들어가죠요 어플 로딩이 전체적으로 느린 건가 했는데 로그인 번호를 잘못 누르면 바로 틀렸다고 뜨는데 맞는 번호를 입력하면 로딩 화면만 뜨고 계좌로 안 넘어가네요 제 핸드폰 문제인가 싶어서 껐다 켜보고 어플을 지웠다가 다시 깔아봤는데도 그러네요 네트워크 문제라기엔 다른 어플들은 멀쩡하게 잘되고 오류 해결 부탁드립니다
3005,4,예전에 비해 많은 부분이 개선되어서 사용하기가 편해졌네요 좀 더 개선되길 바라는 점이 있다면 아직도 느린 로딩 속도와 화면구성과 메뉴관리 등을 좀 더 직관적이고 심플했으면 합니다
3008,4,주거래은행이 국민은행이라서 거의 매일 접속하고 있어요 예적금과 관련해서는 사용하기 편해요 그런데 부동산 대출 등 다른 메뉴는 다른 은행 뱅킹보다 찾기가 어려운지 손이 잘 안가요 그래서 예적금은 국민은행에서 확인하지만 다른 금융업무는 다른 은행에서 주로 검색해요 개인차일 수 있지만 예적금만큼 편하게 다른 금융업무도 할 수 있으면 좋을 거 같아요
3011,4,스타 알림을 별도로 설치해야 하는 것 불편 합칠 수 없다면 국민카드 결제 문자도 스타 알림과 통합되었으면 좋겠음
3015,4,편해요 오류 잘 뜨더니 지금은 괜찮아요 개선 빠르게 잘 해주시네요
3016,4,느려요  다른 은행보다 앱 사용할 때 구동이 너무 느려요 쓸데없는 기능들을 좀 없앴으면 좋겠어요
3017,3,주거래 은행이라 자주 이용하는데 타은행 예신 한 솔 뱅크에 비해 설치해야 하는 어플들이 너무 많습니다 각각 설치하는 어플들이 전문성 측면에서는 더 좋을 수도 있지만 너무 많은 어플 때문에 이 어플이 어떤 어플인지 헷갈리기도 합니다 어플의 통합 원합니다
3020,4,어플 종류 좀 통합했으면 좋겠어요
3023,4,공인인증 사용하지 않고 패턴 형식으로 로그인 되어서 대부분의 은행 업무를 사용할 수 있어서 매우 편리함 다만 패턴을 잊어버렸을 때 다시 복구하는 방법이 힘들지만 필요한 절차라고 봄 이벤트 분야 한가지 말하자면 주야장천 커피만 쥐지 말고 다른 것도 주었으면 합니다
3033,4,주 거래가 국민은행이라 카드 알림 뱅킹 앱 등 오래전부터 사용했는데 점점 속도랑 사용성이 개선되어 좋아 요한 달에 한 번씩 스타 드림 서비스는 굉장히 마음에 들어요
3044,4,계좌 뷰 보기 설정이 3개에서 더 추가되면 좋겠네요 나머지는 사용하기 편리하게 되어 있습니다
3055,4,스타뱅킹 앱 빠릿빠릿하고 좋음 Kb 그룹 다른 앱 계속 만들지 말고 이 앱에 기능들을 통합하면 더 좋을 듯
3056,4,점점 개선되는 것이 보이나 앱 통합이 필요한 것 같음
3057,4,너무 잘 쓰고 있는 어플 중에 하나입니다 앞으로도 잘 부탁드려요
3058,2,램 사용량 최소화 앱 내 화면 전환 시 신속함 전반적인 최적화 이 세 가지 꼭 좀 부탁드리겠습니다 단 한 번의 업데이트로 모두를 만족시킬 수는 없겠지만 고객의 소리에 귀를 기울여 꾸준히 업데이트 해나간다면 분명 고객의 호응으로 보답될 것입니다 위 세 가지가 충족된다면 곧바로 별점 5개로 수정하겠습니다 그럼 기대해보겠습니다
3063,4,대부분 만족합니다 다만 Kb 스타 드림 서비스 신청 시 어려움이 있고 항목에 있어서 좀 더 다양함이 있으면 좋겠습니다
3064,4,간편 로그인 방식이 도입됐지만 여전히 앱 일부 기능은 반응성이 떨어지고 불편할 수 있습니다 또한 카드 증권 앱과 연동할 수 있는 기능도 마련되면 좋겠습니다
3070,4,주거래은행으로 스타뱅킹 쉽고 간편하게 너무 잘 사용하고 있어요 항상 타행 이체할 때에 수수료 없이 해서 좋고요 로그인하는 방법들이 다양해서 편안 걸로 사용할 수 있어 좋고 자주 쓰는 계좌를 등록하여 편이 사용하고 있고 최근 계좌도 좋아요 오픈뱅킹 조회도 너무 편해요 단지 불편한 점은 비슷한 앱들이 너무 많은데 필요한 것들은 설치해놔도 불편해서 잘 안 보게 되더라고요 비슷한 것들은 한 어플에 다 볼 수 있게 해주면 너무 좋을 것 같아요
3074,3,인증 시 시간이 많이 소요되며 자동 로그인을 폰 자체 바이오 인증 안 해도 가능하게 해주면 좋겠네요
3090,3,오랫동안 사용해온 앱 좀 더 단순했으면 좋겠네요
3091,4,스타뱅킹은 첫 스마트폰을 구입하면서부터 15년 넘게 사용하고 있는데 편리합니다 직접 은행에 가지 않아도 웬만한 금융업무를 다 수행할 수가 있어요 그러나 잦은 업데이트는 제발 물론 보안이 중요하니 패치 업데이트를 자주 해야겠지만은 정기적으로 업데이트를 하면 좋을 것 같아요 저장용량에도 한계가 있어서 그 외엔 다 좋아요 편리합니다
3092,4,이벤트도 많이 하고 좋지만 다른 은행들처럼 통합된 앱이 나왔으면 좋겠습니다
3093,4,국민은행 앱을 처음으로 설치해보았는데요 처음 설치하는 이용자로서 관련 앱이 많아서 어떤 앱이 추가로 필요할지 한눈에 알기는 어렵더라고요 그래서 이런 부분이 개선되었으면 해서 리뷰를 남기려고 했는데 먼저 글을 작성해주신 분도 비슷한 의견이 있어서 동감하며 저도 의견을 남기게 되었습니다 리브 리브 메이트 리브 똑똑 KB Pay 등 각 어떤 목적을 가진 사람들이 설치하면 좋은 앱인지 한눈에 정리해놓은 안내 페이지가 있으면 더 좋을 것 같습니다 그리고 통장 개설이나 인증서 발급을 위해 앱을 사용하던 중 홈버튼을 누르고서 다른 일을 하다가 다시 스타뱅킹 앱을 들어가면 작성하던 것이 초기화되어 진행 중인 내역 페이지에 들어가기까지 다시 폰으로 본인인증하느라 반복적으로 했던 작업을 또 하기도 하고 시간을 많이 소비하게 되긴 하더라고요 보안상 이렇게 만들어 놓으신 것 같아서 그 부분은 감안하고 사용하겠습니다
3095,4,장점  은행거래용으로 사용하기 편리해요 이체 잔액 확인 적금 종류 확인 등 아이콘이 직관적여서 사용하기 쉽습니다 단점  관심 계좌 등록 이체한도 조정 등의 은행거래 관련 메뉴를 사용할 때 찾기가 너무 어려워요 카테고리를 쉽게 찾을 수 있게 초기화면에 띄워주시면 좋겠어요
3096,4,사용하면서 오류도 적고 계좌 보는 것도 편리하고 오래 쓴 만큼 익숙해서 좋은데요 너무 여러 가지로 나눠있어서 이것저것 들어가서 확인해 여하고 새로 다운로드해서 등록해야 해서 번거로워요 비슷한 어플은 같은 케이비니까 합치면 좋겠어요
3105,4,10년 넘게 이 어플을 쓰면서 속도 인터페이스가 상당히 좋아짐 아직 타 금융사를 따라가기는 부족한 점이 있지만 상당히 만족 중 다만 리브 리브 메이트 등 잡다한 어플이 너무 많음 통합이 필요해 보임
3109,4,취업하고 계속 메인으로 사용해왔습니다 타 은행 앱들 대비 UI가 직관적이고 앱 자체 안정성도 높아서 만족하며 사용 중입니다 단지 아쉬운 점은 앱 자체가 좀 무거운 느낌이고 금융앱들 모두 해당되나 토스나 칼뱅 대비 KB금융 내 너무 많은 앱들을 좀 정리할 필요가 있어 보입니다 한가지 건의하고 싶은 점은 빠른 이체 기능 매우 만족하며 사용 중인데 등록 가능 계좌를 현 50개에서 100개로 늘려주면 감사하겠습니다
3111,4,국민은행은 다 좋은데 관련 앱을 좀 통일했으면 좋겠습니다 리브며 페이며 다 따로 깔아야 되는 번거로움이 너무 심해요
3114,4,타은행 외화 연계 계좌를 통해 해외 주식을 손쉽게 매수하고 매도하여 연계계좌로 자금 이체를 할 수 있어서 너무나도 편했어요 그리고 펀드 매수 타이밍을 잡을 수 있게 한 달 동안 펀드 수익률 기준가를 그래프로 보고 잡을 수 있게 제공해주면 좋을 거 같습니다 그리고 다양한 이벤트로 고객 참여를 할 수 있어서 혜택도 많이 받고 좋았어요
3116,4,접근성이 좋고 간단히 kb카드 사용 기록도 알아볼 수 있어서 편해요 KB 부동산 시세도 검색할 수 있으면 좋겠습니다
3117,4,사용하는데 크게 어려움은 없으나 좀 더 쉽고 보기 편하게 되어 있었으면 좋겠어요
3120,4,국민은행 앱 좋은데 국민은행 관련 앱이 너무 많아요 통합되면 좋겠어요
3122,4,예전보다 사용 메뉴 등이 편리해지고 자산별 확인이 쉬워져서 좋네요 상세 메뉴 이름을 좀 더 쉽게 찾을 수 있게 해면 더 좋을 것 같아요
3127,4,간편 이체가 잘 돼서 좋아요 노란색 앱 디자인이 눈에 잘 띄어 좋고요 로그인할 때 조금 버벅거리는 게 느껴지는데 제 핸드폰이 구형이라 그런듯하지만 ; 이 부분만 개선된다면 별 5개 각입니다 
3128,4,뒤로 가기를 누르면 화면이 잘 뜨지 않아서 재접속을 하거나 홈 버튼을 터치해야 하는 번거로움이 있습니다 개선 부탁드립니다 
3132,4,빠르고 편해요 자주 쓰는 이체켸좌 같은 항목은 폰뱅킹이랑 pc 인터넷뱅킹이랑 연동됐으면 좋겠어요
3134,1,kb는 심히 어플 통합이 필요함 대체 왜 이렇게 어플이 용도마다 있음 하나은행을 좀 본받아야 어플 때문에 주거래은행 바꾸고 싶은데 일단 참고 있음 진짜 복잡하고 어플이 수십 가지에 아이티 부서 보고 있다면 제발 개선 좀
3138,4,예전보다 레이아웃이 좀 단순해져서 좋네요 앱 이것저것 개발하지 말고 하나로 기능들을 모으는 게 좋겠네요 국민은행 관련 앱만 스타뱅킹 리브 등 몇 개인지 모르겠네요
3154,3,UI 쪽으로 고민해서 개선하면 정말 괜찮을 듯합니다 앱이 약간 번잡한 느낌이 없지 않아 있네요 그리고 메뉴의 통일성이 별로입니다 이곳저곳에 난잡하게 서비스들이 흩어져 있는 모습입니다
3155,4,조금 더 보기 편하게 심플하면 좋겠어요
3159,3,가끔 모바일 뱅킹을 이용하려고 할 때 버퍼링이 너무 길어져 급하게 사용 못 할 때가 종종 있습니다 그리고 이전 화면으로의 전환이 되지 않을 때도 많습니다 또한 한꺼번에 두 계좌이체를 위한 버튼 노출이 찾기 쉽게 되었으면 좋겠습니다 주거래 은행으로 국민만 이용하기에 참고해주시어 개선되기를 바랍니다
3160,4,국민은행 앱은 타은행과 마찬가지로 로그인 방식이 편리하다는 것입니다 다양하고 본인이 원하는 방식을 선택 가능하다는 장점도 있습니다 제가 한 번씩 깜박하는 게 있어서 결제일에 얼마를 넣는지를 잊어먹는 경우가 있어서 애를 먹곤 하는데 카드 결제일 같은 날 안 잊어먹게 알람 설정 기능이 있었으면 좋겠습니다 이런 고객들의 의견을 참조하시고 나날이 발전하는 국민의 bank가 되길 응원합니다
3161,3,공인인증서 오류인듯합니다 인증서 갱신 후 팝업으로 바로 뜨는 지문인식을 항상 못합니다 만료된 인증서라고 뜨는데 저는 이미 갱신을 완료한 상태고 그 창을 종료하고 하단에 지문으로 인증서 로그인을 해야만 로그인이 됩니다 인증서 갱신을 다시 해보려고 하면 이미 갱신했다고 하는데 앱 구동시 동시에 뜨는 지문인식은 여전히 안됩니다 너무 번거로우니 개선 부탁드립니다
3162,4,국민은행 오랜 고객으로 꼭 필요한 앱이에요 웬만한 건 다 괜찮은데 리뉴얼 업데이트 할 때마다 사용이 불편해요 변경되는 게 많아서  계좌 페이지 편집할 수 있도록 해주세요
3164,4,KB 스타뱅킹 앱은 다른 은행 앱들과 비교할 때 깔끔한 인터페이스 사용자 편의성 안정성이 좋다고 생각합니다 다만 KB국민은행은 각 기능별로 별도의 앱이 너무 많아서 각각 들어가서 업무를 처리해야 하는 것에 번거로움이 있습니다 최근 트렌드에 맞춰 주요 앱들을 통합하여 하나의 앱으로 만들면 더 좋을 것 같습니다
3170,4,앱 속도 개선이 필요
3171,4,국민은행 앱들이 너무 많아요 통합 좀 해주세요
3176,4,마이핏 통장 잘 쓰고 있어요 이런 거 아주 좋아요 그런데 잔액을 생활비 잔액만 보이게 설정할 수 있으면 좋겠어요 그리고 비상금에 있는 금액을 출금 안 되게 설정하는 것도 있으면 좋겠어요 출금 안 되게 해놨다가 다시 설정 바꾸려면 어느 정도 날짜가 지나서 되던가 이런 식으로
3186,4,전반적으로 사용하기 편리한 은행 앱입니다 메뉴가 찾기 쉽고 깔끔해서 쉽게 찾아 이용 가능하고 모바일 인증서가 제일 맘에 드네요 오픈뱅킹 등록으로 타은행 계좌도 조회 가능해서 편리합니다 한가지 아쉬운 건 국민은행과 관련된 앱 종류가 너무너무 많습니다 통합 합병해주셨으면 하는 바람이 있습니다
3189,4,대체적으로 사용에 불편함 없이 잘 이용 중입니다 로딩이 늦는 경우가 있어 답답한 경우와 로그인 후 첫 화면을 조금 더 간결하게 하는 편이 좋을 것 같습니다
3193,4,장기간 잘 사용하고 있습니다 그러나 뱅킹 카드 보험 등 kb 이름의 어플 종류가 많아 번거롭습니다 한 개의 어플로 통합이 이루어지면 좋을 것 같습니다
3205,4,이 체내 역에 메모 기능이 있으면 좋겠어요
3209,3,여러 앱 좀 하나로 통합해주세요
3214,4,익숙해지면 또 편해요 다만 리브 리브 메이트 스타뱅킹 어플 합쳐주면 좋겠어요
3219,4,사용하기 편리합니다 근데 속도가 좀 더 빠르면 좋겠네요
3220,3,단순하게 사용자 기준으로 또 영업점 또는 고객센터에서 좀 더 업무를 알도록 했으면 좋겠습니다
3235,4,특별히 불편한 점은 없었고 계좌조회 조건 검색 시 조건 기간에 따른 합계액이 나오면 좋을 거 같아요
3244,4,주거래은행이어서 그런지 앱 아이콘도 노란색으로 딱 눈에 잘 띄며 로그인도 패턴 지문 이식 등 편하게 잘 이용하고 있어요 다른 앱을 사용하지 않아 딱히 다른 불편함은 모르겠네요 그렇지만 불필요한 정보공개로 광고 전화가 자주 와서 불편합니다 여기와는 관련 없겠지만 관계자분들께 말씀 좀 부탁드립니다
3245,4,앱 쓰기 편하네요 좀만 더 빠릿빠릿했으며 네 좋겠습니다
3255,4,다달이 이체해야 하는 부분이 있는데 공인인증서 없이도 복잡하지 않게 간편하게 이체할 수 있어서 편해요 그런데 다른 것을 확인하려면 너무 많은 앱들을 깔아야 해서 그런 건 간소화 시켜 한눈에 볼 수 있었으면 좋겠어요  대체적으로 만족하며 잘 사용하고 있어요
3264,4,필요한 메뉴 찾느라 좀 헤매긴 했는데 오픈뱅킹 편하네요 국민은행 앱만 3개 쓰고 있는데 통합해줬으면 좋겠어요
3265,3,다 좋은데요 은행 가서 본인인증하면 타면의 기기도 사용 가능했으면 좋겠습니다 전에는 됐었는데 이제 안되는 거로 바뀌었어요 무조건 앱 깔린 기기 폰 번호가 자동으로 깔리는데 수정도 안되고 그게 매우 불편해요
3271,4,자주 사용하는 메뉴를 개인화하여 제공해 줬으면 합니다 또한 지문인식이 안 된 경우 칼뱅처럼 바로 다시 인식할 수 있도록 개선 바랍니다
3277,4,자주 앱 사용합니다 편해요 계속 편한 기능 업그레이드 부탁드립니다
3281,4,사용하기 편리하고 노란색이라 깔끔하고 이뻐요 메뉴가 통합되면 더 편리할 거 같긴 해요 로그인도 간편화되면 편하고 좋을 거 같아요
3289,4,입출금 내역에 간단히 메모 남김 기능이 있으면 좋겠어요
