,score,comment
1490,1,자급제 폰 사용자는 지문 등록할 때 본인인증하기에서 막혀서 등록이 안 되는데 다른 금융 알림 어플들은 잘만 등록이 되는데 왜 여기만 안 되는지 모르겠네요 해결해주세요 자급제 폰이라고 본인인증이 안 되는 게 어딨습니까 요즘 세상에
1494,1,어제부터 접속이 에러 뜹니다  빨리 조치해주세요
1507,1,예전에 홍채인식으로 진행할 땐 될 때보다 안될 때가 많았습니다 백그라운드 실행 앱 전부 끄거나 재부팅해야 간신히 되더군요 몇 번 겪다가 그냥 귀찮아도 공인인증서 비번치는 걸 선택했습니다 최근에는 지문인식 등록했더니 방금 등록하고 로그인하려는데 정보 변경됐다고 재등록하라고 뜨고 재등록해도 또 재등록하라고 무한 반복이라 포기했습니다 간편 번호인가 등록했더니 이체 화면 들어갔더니 인증이 필요하다고 다시 로그인해야 하더군요 주거래은행이 국민은행이라 가장 많이 쓰고 있긴 한데 타행으로 갈아타고 싶을 정도입니다 은행 앱 쓰는 게 대여섯 개 정도인데 앱 편의성은 이 앱이 최하입니다
1543,1,어플 오류 때문에 앱 닫기만 나오는데 해결 부탁드립니다 엘지 벨벳입니다
1544,1,자꾸 로딩 중이라면서 나중에 오류 뜨고 튕기네요 빨리 해결해주세요
1550,1,너무 잘 쓰던 어플인데 한 달 전부터 정보를 불러오는 중이라고만 뜨고 연동이 안됩니다 빠른 조치 부탁드리겠습니다 업무상 너무 불편해서 급히 처리할 은행 업무를 처리 못하고 있어요
1551,1,진짜구려요 로그인 화면에서 안 넘어간 게 몇 번째인지 개선도 안되고 매번 삭제해서 다시 까는 게 해결 방법인가요
1552,1,어플 실행할 때마다 무한 로딩인데 수정 좀 해주세요
1554,1,진짜 제발 어플 좀 제대로 만드세요 개발자가 없나요 며칠 아니 몇 주 전부터 그러는 거 같은데 아예 안 들어가진다고요  그럼 어플을 왜 만드신 거죠 삭제했다 깔아도 아예 첫 인증서 불러오는 화면에서 멈추는데 진짜 개화 나네요 욕이 나와요 너무 답답하고 어이없어서 이럴 거면 왜 어플을 만드는지 개발팀이 없는 건지 외주를 주나요 제발 제발 개선 좀 해라 리뷰 안 보나
1569,2,어제 어플을 사용하려고 클릭하는데 자꾸 안되길래 전원 끄고 다시 키니 어플이 사라져 있네요 평소에도 버벅거림이 점심하고 하루 종일 로딩일 때도 많아요 개선이 필요해 보입니다 그리고 어플이 왜 자기 멋대로 사라진 건지
1576,1,잘 쓰고 있었는데 며칠 전부터 갑자기 정보를 불러온다고만 뜨면서 화면이 멈추네요 어플만 키면 폰이 이상해지는데 지우고 깔고 데이터 삭제하고 켜도 똑같은 증상만 반복돼요 오류 개선 좀 해주시죠
1589,4,직관적이긴 하나 기능을 한 앱에 넣으면 좋겠음
1590,1,앱이 계속 튕기는데 해결 방법 부탁드립니다
1608,1,로그인 계속 실패하고 아 정말 짜증 나네요 오류 뜨는 거 개선 안 하나요
1613,1,일주일 넘게 먹통입니다 어쩌다 지문인식으로 로그인하면 또 그대로 먹통이고요 어플 실행시키면 폰이 멈춰요 빨리 복구해주세요
1615,1,어제부터 로그인이 안 됩니다 빠른 조치 부탁드립니다 기종은 LG VELVET입니다
1640,1,삭제하고 다시 설치해도 앱 로그인도 안되고 터치해도 아무것도 반응 없고 며칠 전부터 이러는데 너무 불편하네요 요즘 세상에 피씨로만 뱅킹 된다는 게 문제 있네요 얼른 해결해주세요
1662,1,인증서가 왜 필요하고 너무 귀찮아요
1676,1,서버 제대로 좀 관리 좀 해주세요 먹통이네요
1679,1,갤럭시 s10 쓰고 있는데 신규 가입 시 1원 입금으로 본인인증을 해야 하는데 입금이 안 돼서 진행을 못하고 있습니다 조치 좀 취해주세요
1696,1,지문인식 안 되면 연달아 할 수 있게 좀 해주세요 굳이 x 누르고 다시 지문인증 누르고 번거롭게 바뀐 건지 원래는 됐었는데 왜 기술이 뒤로 가나 모르겠네요
1704,1,잘 사용하다가 업데이트하고 나니 공동 인증서 타행 등록만 하면 튕겨나가요  빨리 수정해주세요
1715,1,타사 어플 벤치마킹 좀 해주세요 메뉴도 눈에 잘 안 들어오고 오류도 잦고 전체적으로 인터페이스 자산 분석 리포트 같은 것들이 눈에 너무 안 들어옵니다
1726,2,계좌 이체 입금 시 실시간으로 새로 고침되게 해주세요 너무 불편하네요
1731,1,계속 튕겨서 삭제했다가 깔았는데도 안되네요 잘 쓰다가 오늘 갑자기 안돼서 불편해요 개선해주세요
1745,1,앱 먹통입니다 앱 시작 시 KB 모바일 인증서 창의 정보를 불러오는 중입니다라는 화면으로 시작하는데 여기서 렉 걸리다가 에러 처리되며 앱 닫기 대기 선택의 연속입니다 간혹 렉 걸리다가 인증서 재등록 순서로 넘어가는데 지문등록 성공 후 단계에서 또다시 렉에 더 처리의 루프에 빠집니다 이틀째 사용 못 하고 있어요 개선 좀 해주세요 이 앱 1년도 안 썼는데 몇 번째 먹통인지 모르겠네요
1752,1,계좌를 만들어야 해서 설치했는데 회원가입부터 막히고 있어요 1원 입금 인증에서 계좌번호를 입력하고 아무리 인증을 요청해도 입금이 안 들어오고 인증번호 입력하는 창도 안 뜨네요 뭘 어쩌란 건지 오백 번쯤 요청한 것 같은데 답답해서 돌아가시겠어요 은행 갈 시간이 없어서 설치한 건데 진짜 빡돌아요 마치 제가 공짜로 1원 받겠다고 구걸하고 있는 것 같은 기분이에요 제발 회원가입 좀 하게 해주세요
1789,1,와 아직도 개선이 안됐네요 또 로그인이 안 돼요 게시되어 있는 방법 다 써봐도 안되고 은행 옮겨야 할까 봐요 그냥 다시 우리은행으로
1794,3,개발자님 이거 네트워크 오류가 계속 뜨길래 지웠다가 깔았는데 로그인 자체가 오류 뜨네요 해결 좀 해주세요 
1816,1,공인인증서 접속이 에러 발생으로 사용할 수 없습니다 4월 1일은 사용했는데 오늘 안되네요 해결 부탁드립니다
1820,1,자꾸 오류가 나서 어플도 삭제하고 다시 깔았고 v3도 다시 깔았는데 계속 로그인 안 되고 오류 나네요 이번에는 거래 중 오류라고 뜹니다 해결 부탁드립니다
1823,1,접속 안되면 바로바로 공지 좀 해주세요 이유도 모르고 이게 먼가요
1838,3,다른 은행 어플은 잘 접속되는데 KB는 고객님의 무선통신이 문제 있다고 하니 당황스럽네요 폰 재부팅해도 동일한 증상입니다 이렇게 리뷰 남기는 것도 통신 접속되었으니 남기는 건데 해결해주실 거죠
1842,1,아니 뭐 안되는 건 둘째치고 뭔 공지라도 해줘야지
1848,1,정말로 점점 정이 떨어집니다 13년이 넘은 고객이지만 요새 점점 개판 오 분 전 돼가는 모습에 화가 나네요 인터넷 기사에서만 은행 1위 금융그룹 1위 하지 말고 고객들에게 제대로 된 1위의 서비스를 해주세요 이게 뭡니까 웬만하면 안 이러는데 단말기 유심칩 인증 오류는 또 뭡니까 어이가 없네요 이제까지 접속 오류 참았지만 정말로 화가 납니다 정신 차리세요 1위 운운만 하지 말고 진정한 서비스 1위의 위엄을 보이세요 참나
1850,1,어플 개선 좀 해요 진짜  툭하면 접속 안되고 느려터지고 아 진심 대출만 아니면 은행 바꾸고 싶다
1851,1,어제오늘 계속 로그인이 안 되네요 돈을 이체해야 하는데 계속 못하고 있어요 제발 빨리 좀 고쳐주시죠 리뷰 잘 안 쓰는데 너무 화가 나서 올립니다 KB만 왜 이 모양이죠 항상 국민카드 앱도 별론데 휴 회사가 하필 국민이랑 제휴라니 빠른 개선 부탁드립니다
1869,4,국민은행이 주 거래라 써요 하나로 합쳐지면 좋을 거 같은데 암튼 조회나 이체할 때 주로 쓰고 있어요
1871,4,잘 사용하고 있습니다 리브 앱도 같이 사용 중인데 두 앱의 기능이 많이 중복되는 것 같기도 합니다 상세하기는 스타뱅킹 앱이 더 좋고요 KB금융그룹 관련 앱들이 많은데 어느 정도 통폐합이 되어야 하는 게 아닌가 싶네요 아니면 각 앱들이 어떤 점에서 특화가 되어있는 건지 어떤 이점이 있는 건지 좀 더 설명을 해주면 좋겠습니다
1874,3,어플이 너무 많고 무거워요 통합 가능한 건 통합할 수 있으면 좋겠네요
1875,4,화면전환에 다소간 시간이 걸린다는 것 외에 시스템적으로 불안정함을 느낀 적은 없어서 기술적으로 크게 불만은 없습니다 앱이 담고 있는 메뉴들이 방대하기도 하고 구성도 짜임새가 있어서 알차게 느껴지기도 하고요 다만 이게 장점이자 단점이 될 수도 있는 것이 화면이 많은 정보들로 채워져 있어서 깔끔하고 시원한 이미지는 덜한 편입니다 조금 산만한 느낌일 수도 있고 시력이 좋지 않은 어르신들께선 사용이 불편하지 않을까 싶기도 하네요 자주 사용하는 메뉴는 강조하고 사용 빈도가 낮은 메뉴들은 화면에 크게 들어내지는 않되 챗봇 상담을 활성화하는 것이 어떨까 싶습니다 그리고 전 계좌조회에서 수시입출금 예금과 저축성 예적금은 서로 성격이 다른 자금이니 분리가 되어서 조회되면 더 좋을 것 같습니다
1876,4,전보다 사용 환경이 많이 좋아졌네요 필요한 목록 찾기도 편하고 단지 구동이 가끔 늦는 게 앱 문제인지 통신상의 문제 인지 아무튼 좋은 쪽으로 많은 개선 바랍니다
1878,4,주 거래가 KB라 정말 많이 쓰고 편리하게 사용하고 있습니다 근데 이직으로 급여 일자가 바꿔서 급여일 변경을 하려고 메뉴를 찾아보았으나 찾지 못했습니다 직장인이라 시간 내기가 무척 힘듭니다 혹여 이미 메뉴가 있다면 알려주시고 개발이 가능하다면 급여일 변경 메뉴도 가능하게 해주시길 부탁드립니다
1885,4,편리하고 좋아요 거래내역 문자도 받을 수 있으면 좋겠어요
1892,1,앱을 켜고 지문 로그인과 동시에 앱이 종료되는 현상이 반복적으로 발생하고 있습니다 문제 해결 부탁드립니다
1900,4,KB국민은행 스타뱅킹을 자주 이용하다 보니 지문인증 및 공인인증 4자리 통장 비밀번호 6자리 비밀번호 전화번호 인증 등 여러 번 확인하는데도 습관화되어 맹목적으로 본인의 실수로 모 증권회사에 1억 원을 오송 금하여 다시 되돌려 받는데 애를 쓴 적이 있습니다 코로나 바이러스 19로 인해 비대면 계좌 이체 실수가 빈번하다는 뉴스도 듣고 본인 실수도 해 봐서 아는데 KB국민은행 스타뱅킹을 이용하는 고객으로써 조금 더 많은 인증 단계 및 비밀번호를 추가하여 개인 통장에서 이체 시 본인처럼 실수를 줄일 수 있는 대책이 필요하다 생각합니다
1904,3,숫자 키패드를 좀 더 굴고 진하게 했으면 좋겠어요 글씨 색도 중요 부분은 진한 색으로 표시해주세요
1909,4,메인화면에서 스타샷이 아닌 예금계좌의 비밀번호 변경처리가 예금관리에서 두 번 클릭으로 찾을 수 있었으면 해요 귀여운 캐릭터로 처리 알림 있으면 좋겠네요
1912,4,은행 가지 않고 편하게 해서 좋은 것 같습니다 하지만 초기화면에서 로딩이 자주 오래 걸리는 점은 개선해야 할 것 같습니다
1920,3,두 가지만 고쳤으면 합니다 하나는 고치기 쉽지 않고 다른 하나는 쉽게 고칠 건데요 1 앱의 실행이 느립니다 이건 은행들 앱의 공통점인 것 같은데 희한하게 굼뜨고 답답한 느낌을 주네요 은행 앱 중 SC제일은행 앱을 제일 처음 사용했는데 느려서 한심하다 했지요 그런데 뒤에 신한은행 하나은행 KB국민은행 앱을 써보니 SC제일은행 앱은 오히려 빨랐네요  2 폰트 중 명조체 사용은 지양했으면 좋겠어요 이런 데 어울리지 않고 가독성도 오히려 떨어집니다 sans serif 계열 폰트를 쓰도록 바꾸세요
1922,1,정말 이상해요 어플 실행하면 속도도 느리고 계속 안되면서 에러 나오는데 못쓰겠으니 업데이트하던지 개선하기 바람
1936,4,주거래 은행이라 자주 사용하고 있습니다 타은행 포함 전 계좌 조회 및 이체도 돼서 편합니다 다만 국민은행 관련 어플이 너무 많아서 통합 어플로 만들어주셨으면 좋겠습니다
1944,4,국민은행을 이용하기 때문에 스타뱅킹 앱을 사용하고 있는데 전반적으로 괜찮게 만들어진 앱입니다 그럭저럭 편리한 면도 있고요 그런데 국민카드나 KB증권 같은 계열사 앱들도 통합하면 좋을 것 같아요
1949,4,어플 자체는 문제없는 듯해요 UI도 깔끔하고 딱히 은행을 가지 않아도 업무처리도 가능하고 편함 다만 아쉬운 점이 있는데 어플이 분산되어 있다는 점 대표적으로 알림 받으려면 따로 알림 어플을 깔아야 한다는 게 너무 불편하다 이런 것만 좀 개선해주면 완벽
1951,4,주거래은행이라서 계속 사용 중이에요 입금 알림 주는 스타 알림이 따로 있는데 계속 에러가 자주 나서 통합해주면 더 좋을 것 같아요
1960,4,주거래 은행으로 국민은행 앱 애용자에요 현재 앱이 이전 버전보다 사용자 편의나 가독성 측면에서 훨씬 좋아요 인증 방식이 간편해지면서 더 자주 쓰게 되는 것도 한몫했고요 별 하나 뺀 이유는 가입된 예적금 혹은 다른 금융상품의 현재까지 이율 혹은 이윤이 타은행처럼 바로 보이면 좋겠어요 지금은 각 상품 들어가서 예상 이율 거기다가 해지 날짜까지 달력을 넘겨서 선택해야 해서 번거로워요
1965,4,은행 앱 중에서는 인터페이스가 가장 편함 하지만 연금저축펀드 내 펀드 종류가 증권사 대비 수가 적어 선택 폭이 좁음 이건 시급히 개선해야 한다고 봄
1971,1,업데이트할 때마다 앱이 안 켜져서 매번 재설치해요 안정성 개선 좀 해주세요
1976,4,금융 어플의 중요한 부분 중 하나는 속도보다는 보안과 안전유지에 있을 것이다 이에 국내 금융 어플들처럼 터치 속도는 빠르게 작동되는 체감을 느끼기는 어렵지만 오픈뱅킹의 편리함이 계속 사용하게끔 한다 그럼에도 속도 문제와 초기 가입 시에 인증 문제는 조금 더 개선되어야 할 것이다
1977,1,가끔 들어갈 때마다 고스트 현상이 생겨요 개발자 고용해서 최적화 좀 해주세요
1984,4,주거래은행 앱으로 잘 쓰고 있습니다 큰 불편은 없고 다양한 로그인 방식에 직관적인 화면 구성도 만족스럽습니다 다만 가끔씩 이용 중인 화면이 종료되는 경우가 있습니다 특히 처음 로그인할 때 앱 꺼짐 현상이 한 번씩 발생합니다 그 부분 조치 부탁드립니다
1989,4,좀 더 직관적이면 좋겠어요 필요한 정보 찾는데 어려움이 있네요
2003,4,오랫동안 스타뱅킹을 편리하게 사용하고 있습니다 다만 메뉴가 많아져서 헷갈리는 부분도 있고 국민은행 관련 앱이 여러 개 있는데 통합하여 관리했면 좋겠네요
2015,4,대학 들어가자마자 첨 계좌 튼 은행 아직까지도 쓰고 있음 모바일 인증서 생기고 더 편해졌음 은행 어플 중에 나름 괜찮은 듯 어플이 가끔 느릴 때가 있는데 그거 좀 개선해주세요
2019,4,전체적으로 편리한 기능을 갖추고 있으나 투자 상품에 대한 정보를 보다 쉽게 이해할 수 있도록 개선되면 더욱 좋을 것 같네요
2034,4,KB 스타클럽 이용 시 접속자 수가 많아서인지 오전 10시 오픈 시간에 맞추어도 접속이 너무 느립니다 이용자 수가 많아지는 상황에 맞게 개선되었으면 합니다
2036,3,개선 요청을 해도 개선을 안 한다 못하는 건가
2042,2,입금을 받았으면 상대은행이나 계좌번호도 표시하게 해주세요
2043,4,전반적으로 편리하나 첫 화면에 계좌가 자동으로 나타나면 좋을 듯
2049,3,자주 쓰는 기능 거래내역 조회의 눈에 띄게 배치 혹은 강조됐으면 좋겠어요
2052,4,장점 1 로그인 방식이 마음에 듭니다 2 활용하기가 어렵지 않습니다 3 숫자나 표기 방식이 보기 명확합니다 개선점 1 로그인 속도와 페이지 이동이 빨랐으면 좋겠습니다 2 소액은 보안카드 없이 이동 가능했으면 좋겠습니다
2058,4,앱 메뉴가 개선되어서 좋네요 많이 사용하는 항목을 직관적으로 찾을 수 있어서 편합니다 앞으로도 꾸준히 개선 보완해주길 기대합니다
2071,4,너무 앱이 많아서 서로 통학돼있으면 좋겠습니다 그거 말고는 다 좋습니다
2076,1,돈 좀 번 다음에 서버에 투자 좀 해주세요 심심하면 오류 나서 튕깁니다
2093,4,잘 쓰고 있습니다 그러나 많은 국민은행 관련 어플들을 일일이 다운로드해야 하는 건 개선됐으면 좋겠네요 어느 정도는 통합됐으면 하는 마음입니다
2094,4,리브 리브 메이트 통합할 수는 없나요 주거래은행이라 쓰고 있기는 하나 여러 앱을 깔아야 해서 불편하기도 합니다 카카오뱅크처럼 계모임 할 때 모든 친구들이 다 볼 수 있는 계좌도 있었으면 좋겠어요 아니면 있는 건지 제가 못 찾는 건지 모르겠지만요
2097,1,앱이 일주일째 열리지도 않고 폰을 freezing 상태로 만들어 너무 불편합니다 그리고 한참 후에 앱이 반응하지 않는다고 메시지나 뜨고  제거하고 다시 깔아보는 중입니다 에러가 생기면 빨리 해결해줘야 하는 거 아닌가요
2100,4,처음엔 적응 시간이 필요했는데 지금은 이체를 비롯한 사용이 편리해요
2115,4,주거래 은행으로 잘 사용하고 있는데요 다만 개선될 점이 있다면 패턴으로 로그인 시에 가끔씩 튕겨져나가는 오류가 빈번하게 있어서 이거 외에는 편하게 사용하고 있어요
2123,4,로그인할 때 내가 설정한 방식이 바로 나왔으면 좋겠어요
2124,4,은행 업무를 보는데 편하다 그러나 앱 가동 속도가 느린 편으로 더 빠르게 가동되면 좋을 것이다 전체적으로 괜찮다
2125,4,아주 편하게 잘 되어 있는 것 같아요  하기도 편리하고 다른 사람들에게 추천해줘서 같이 쓰고 있어욥
2130,4,디자인 면에서는 깔끔하게 잘해놓으셨는데 속도 부분이 좀 더 개선되었으면 좋겠어요 편리하게 잘 이용할 것 같습니다
2136,3,잘 쓰고 있습니다 근데 다른 뱅크 앱보단 살짝 속도 면에서 느린 게 불만입니다 속도 개선이 필요해 보여요 그 외에는 만족합니다
2140,4,개선을 통해 쓰기 한결 나아진 것은 같은데 리브 메이트 같은 다른 앱들과도 통합되었으면 좋겠어요
2145,2,앱을 실행시킬 려 했는데 자꾸 튕깁니다 로그인을 하려 해도 화면이 껴졌다 꺼졌다를 반복하고 있습니다 국민은행 앱 쓰면서 이렇게 불편한 점은 없었는데 문제점이 무엇인지 답변해주세요
2154,1,아니 금융 인증서 필요해서 받으려고 하니깐 화면이 계속 점멸되면서 꺼졌다 켜졌다 반복하네요 어플 자체가 실행을 할 수가 없어요 최대한 빠른 업데이트 바랍니다
2157,2,업데이트 후에 접속 장애가 생김 빠르게 조치해주세요
2158,1,인증번호 로그인 화면 잘 쓰고 있는데 터치하기 힘들게 왜 이렇게 작게 바꿨나요 익숙해진 ui 자꾸 건들지 마세요 시스템이나 개선하세요 왜 자꾸 UI 건드려요 네
2159,1,어플이 검은 화면 흰 화면 번쩍이면서 깜빡거리기만 하구 켜지지가 않아요 확인 부탁드립니다
2164,3,인증서 비밀번호 입력 버튼의 크기를 크게 해주세요 최소한 쿼티만 하게는 해줘야죠
2167,3,오늘 어플 왜 이래요 어플 실행 시 화면 깜빡거리고 접속이 안되네요 지웠다 다시 깔았는데도 그래요 확인해주세요
2169,4,속도가 빨라서 좋아요 그런데 이벤트를 하게 되면 느려지더라고요 여러 명이 동시 접속해서 그런 것 같기는 한데 개선할 필요성이 있어 보여요
2174,4,주거래 앱이라 자주 사용하고 있습니다 사용상의 불편함은 없지만 다른 앱이랑 통합되어 하나로 사용하면 더 좋을 것 같네요
2176,4,KB 관련 앱이 너무 나누어져 있네요 여러 기능이 통합된 하나의 앱 부탁드려요
2180,4,느린 거만 개선하면 좋을 텐데요
2190,4,주거래은행이라 자주 사용합니다 관련 앱이 너무 많아 통합할 필요성이 느껴지는 것 말고 편의성 면에서 좋네요
2192,3,인증이 좀 더 간소화되었으면 합니다 나이 많은 어른들도 쉽게 쓸 수 있도록 개선되었으면 좋겠네요
2193,4,초기 앱은 너무 느리고 복잡한 메뉴 때문에 주로 PC 홈뱅킹을 사용하다 최근 들어 앱을 많이 사용하고 있어요 하지만 좀 더 직관적이고 간결한 메뉴체계와 빠른 처리가 가능한 미니멀하고 스마트한 앱으로 발전했으면 좋겠네요
2197,4,국민은행 관련 그룹사 이동이 편해요 빠른 이체 기능도 개선되어서 쓰기 편합니다 하지만 로열스타클럽이라지만 매월 주시는 쿠폰 혜택을 거의 받을 수가 없네요 매번 soldout이라서 좀 더 많은 혜택이 있었으면 좋겠습니다 그룹 사 중에 증권과 저축은행의 연동이 좀 불편합니다 이체하기가 좀 어렵네요
2202,1,인증서 비밀번호 입력 시 나오는 키패드 원래 크기로 해주세요 쪼매내서 입력하기 불편합니다 간편 인증이니 뭐니 그런 거 사용하게 만들기 위해 일부러 작게 줄인 겁니까 툭하면 먹통 되는 거 참고 쓰는데 이건 아닙니다
2204,4,KB국민은행 앱 자주 애용하고 있습니다 마이 메뉴 기능을 자주 사용하고 있고 스타 드림으로의 접근성이 불편한데 개선해 주셨으면 합니다
2205,4,주거래 은행 앱이라 매일 접속하고 자주 사용하고 있습니다 KB 모바일 인증서 사용하고 있어서 로그인이 간편하고 좋은데 앱이 통합되어 있지 않고 분리되어 있어 KB 관련 여러 앱을 설치하고 로그인해야 하는 점이 불편하니 개선 부탁드립니다
2210,4,이점보다는 나아진 것 같지만 아직 개선되어야 할 점이 많아 보입니다
2222,4,주거래 은행으로  스타뱅킹 앱  사용 중입니다 최근 인증 제도 변경으로 도입된 모바일 인증서를 사용 중인데 이전 공인인증서보다  훨씬 편리해져서   금융 업무가 한결 더  수월해졌네요 앞으로도 질 좋은 서비스 부탁드립니다
2223,4,필요한 것을 찾고 잘 실행하고 있어요 이벤트도 다양해서 좋아요
2226,4,조금 심플했으면 좋겠네요
2235,4,국민은행이 주거래 은행이기는 한데 앱 이용은 너무 불편해요 은행 앱과 카드 앱까지 너무 많은 것들이 나눠져 있고 최근엔 케이비 페이까지 너무 정신없어요 깔았다가 지운 앱도 몇 개 됩니다 스타뱅킹 내에서는 관리 기능이 나눠져 있어서 기능 찾기가 어려워요 자동이체 등록과 검색도 타행 당행 나눠져 있어 불편해요 그리고 스타샷은 이름을 봤을 때 뭔 기능인지 알 수가 없는 것 같아요 아이콘 디자인도 직관적이지 않아서 복권 관련 기능인가 싶기도 하고요 굳이 필요한 기능인가 싶네요 마이메뉴에 뱅킹 관리에 필요한 기능을 모아두는 게 어떨까 하네요
2237,4,대체적으로 만족하나 다른 분들이 느끼는 거처럼 국민 관련 앱들이 너무 많아서 폰 폴더 함게 국민이라는 폴더가 있을 정도예요 통합해서 관리가 된다면 불편한 없이 좋을 거 같아요
2238,4,로그인 방식 설정이 하단에 있어 좀 불편했고 타은행도 사용 중인데 주 거래가 국민인데 이체나 뭐나 쓰는 게 제일 번거로운 거 같아요 예전 버전인 줄 알고 찾아보기까지 로그인 방식 설정 등 사용하기 좀 더 단순하면 좋겠어요 찾을 거는 검색으로 찾으면 빠르고 어플 사용만 좀 더 간편해지면 좋을 거 같아요
2243,3,간편 로그인할 수 있어서 편해요 긍대 간편 로그인하면 이체가 안되네요 공인인증서 로그인하라고 뜨는데 간편 로그인해서 이체도 바로 할 수 있으면 좋겠어요 그리고 계좌번호 복사할 때 숫자만 복사되면 좋겠어요
2250,4,스타뱅킹 앱이 타 금융사보다 기능이 많은데 너무 많은 카테고리가 있어 처음 이용하는 사람들에겐 불편함을 줄 수도 있다고 봅니다 조금 더 심플한 화면으로 구성되면 더 좋을 거 같습니다
