,score,comment
4225,4,어플이 좀 무거워서 느린 건 단점이지만 아마 보안 프로그램 설정상 어쩔 수 없이 한 선택이 아닐까 하고는 있습니다 그것보다 KB 관련 어플이 너무 많아서 리브 리브 메이트 등등 이걸 기존 은행 어플에 통합하든지 차이를 명확화하든지 할 필요가 있어 보입니다 나름의 기능들을 홍보하지만 읽고 이벤트 응모하고 까먹습니다
4226,4,1번호 표 미리 뽑을 수 있는 기능 최고 좋습니다 2매뉴얼이 직관적이고 사이트 효율성이 좋습니다 아쉬운 점 한 가지는 모바일 otp가 빨리 지원되었으면 좋겠습니다
4230,4,그냥 쓰기에 괜찮아요 사용하기 편리하게 메뉴와 AI를 업데이트했으면 좋겠어요
4232,4,공동 인증서가 되면 거 로그인 화면이 너무 여러 가지이다 보니 불편 내가 주 사용하는 것만 나왔으면 좋겠어요
4233,4,사용하기에 구성이 편리해서 원하는 항목을 찾기 좋습니다 개인적으로는 kb가 이벤트가 다양한 편인데 이벤트 알림이 오는 게 좋았고 진행 중 이벤트 내가 응모한 이벤트 등으로 구분해서 쉽게 볼 수 있는 것도 타은행은 어려운 경우가 있던데 매우 마음에 듭니다 지문인증 사용이 가능한 부분도 좋네요 다만 개선이 가능하다면 메인 화면에 로그인하자마자 마이페이지가 뜨면 좋을 것 같습니다 보통은 본인 계좌 관련하여 사용하기 위해 앱을 켜게 되니까요
4236,4,좋아요 편리하고 근데 kb는 너무 여러 앱들이 있어서 헷갈려요 스타뱅킹 마이 머니 포인트리 통합되면 좋겠어요 아 그리고 뱅킹 가끔 써보면 문자가 안 와요 무슨 설정하라고 문자 오긴 하는데 복잡하네요
4246,4,대체적으로 만족합니다 모바일 번호표 뽑기 아주 편하고 좋아요 대기인원이 줄어는 게 실시간 반영되었으면 좋겠어요
4252,4,노란색 아이콘 눈에 잘 띄어 좋아요 빠른 이체 자주 쓰는 계좌 좋아요 이체로 한 계좌번호도 확인 가능하면 좋을 것 같아요
4274,4,메뉴 간 이동은 편리하지만 환경이 크게 달라져 익숙하게 사용하려면 시간이 필요하다 보다 더 직관적이면 좋겠다
4278,4,예전에는 좀 불편하고 버벅거렸는데 많이 개선된 거 같아서 이용에 불편함은 없습니다
4281,4,사용은 편리하나 좀 더 직관적이고 깔끔한 UI를 제공했으면 좋겠네요
4283,4,많이 개선되었지만 앱 통합 좀 해주세요 입출금 알림까지 앱을 따로 깔아야 하는 건 이해할 수 없네요
4285,4,김은영 좋아요 다양한 정보가 있어서 앞으로도 더 좋은 이벤트로 깜짝깜짝 서프라이즈 이벤트 많이 해주세요 크지 않아도 소소한 기쁨을 주는 그런 따뜻한 앱으로 거듭나시길 바랍니다 코로나 블루 KB 스타 앱이랑 날려버려요
4286,4,경민정일단 로그인 시 시간이 업데이트할 때 보다 오래 걸린다 전보다 더디게 로딩 되거나 오류가 자주나 불편함이 있고요 신한 농협에 비해 간편 이체가 안되어서 외부에서 이체할 때 식은땀을 종종 흘려요 대출 통장과 주거래은행으로 옮기며 이체할 일이 많은데 이 부분 개선되길 바랍니다
4294,4,잘 사용하고 있어요 가끔 이유 없이 로그인과 동시에 꺼지는 부분은 확인이 필요할 거 같아요
4297,4,딱 필요한 기능은 바로 사용할 수 있게 하단에 배치되어 있어 좋아요 내 계좌로 이체하면 오티피 카드 없이 바로 이체되어서 편하고 단점이라면 국민은행 관련 어플이 너무 많아요 리브 리브 메이트 마이 머니 등등 너무 많아서 차라리 합칠 건 합치고 해야 할 거 같아요
4298,4,영업점 상담 예약 기능 유용하게 잘 쓰고 있어요 펀드 같은 경우 연간 수익률 추세를 그래프식으로 보여주면 더 좋겠습니다
4306,4,국민은행 이용하는데 좀 더 가벼워졌으면 좋겠어요 로딩이 너무 길어서 급할 땐 다른 매체를 쓰게 됩니다 그래도 예전보다 빨라져서 자주 이용해요
4310,3,계좌 확인할 때 메뉴가 보기 편해서 좋은데 로그인할 때 자꾸 에러 나요 로그인은 됐는데 화면이 안 바뀌는 현상이 계속 나요 국민 오래 썼는데 제발 어플 좋아졌으면 좋겠어요 그리고 어플 계속 만들지 말고 통합해줬으면 좋겠어요
4311,4,다 좋은데 국민은 어플이 너무 많아요 한두 개로 통일 좀 해주세요
4318,4,앱 메뉴를 좀 더 편하고 찾기 쉽게 변경 필요 예를 들어 매월 자동 이체하려면 여러 단계를 거쳐 들어가야 함
4320,4,사용하기 편해요 다만 내 통장에 별명을 입력할 수 있게 해줬으면 좋겠어요 가끔씩 이체하다가 다른 통장에서 나갈 때가 있어요 빠른 이체할 때 먼저 보냈던 통장으로 자동 연결되었으면 좋겠습니다
4321,4,대체로 좋은데 좀 더 간편히 이체 가능하면 좋겠네요 보안카드 매번 쓰기 귀찮아요 
4322,4,가끔 인증 오류가 생기는 경우를 제외하고 잘 쓰고 있습니다 보다 다양하고 많은 이벤트 및 포인트 제공이 되었으면 좋겠어요 또 KB는 어플이 너무 세분화되고 많습니다 카드 리브 뱅킹 등등 그런 것치곤 하나하나의 어플들이 그리 가벼운 것도 아니에요 왜 굳이 다 나누신 건지
4323,4,편리하면서도 필요한 정보가 쏙쏙 들어있고 속도도 빨라서 좋아요
4326,4,지문도 되고 변화가 보이네요 다른 계좌 이체 시 칼뱅처럼 소액은 오티피 안 했으면 좋겠네요 항상 안 들고 다니는데 이체 시 칼뱅 계좌로 옮겼다 거기로 보냅니다
4328,4,깔끔하고 이용하기도 편리합니다 다만 제로 페이도 여기서 같이 이용할 수 있으면 더 좋겠어요
4331,3,KB 국민은행 앱 하나로 리브 메이트나 부동산 등등 연관 앱이 한 번에 이용할 수 있으면 좋겠어요
4334,4,패턴 지문으로 로그인 하는 게 너무 간편하고 좋아요 근데 간혹 타행계좌가 등록이 안되는 것들이 있어서 그런 것 좀 해주시면 더 좋을 것 같아요
4356,4,이용은 편하지만 관련 앱이 여러 개 필요해서 1개 앱으로 여러 기능을 지원할 수 있으면 더 편할 것 같습니다 항상 잘 쓰고 있어요
4357,4,좋아요 근데 앱 개수 좀 줄였으면 좋겠습니다
4358,3,잘 사용하고 있어요 혜택이나 이벤트가 늘어나면 좋겠네요
4366,4,어플 실행 시 v3 재실행 등이 필요할 때가 있는데 다른 은행 어플 구동보다는 초기에 시간이 더 걸리는 것 같네요 나머지는 soso
4369,1,이체하려고 하면 왜 최종 이체 노란 버튼이 안 눌리고 앱이 먹통이 되나요 저번에 콜센터에 전화했을 때도 문제 해결이 안 되었는데 폰 문제라기엔 다른 금융 어플은 너무 잘 됩니다 이 리뷰 작성 후 작성해주신 댓글대로 따라 했는데도 이체가 안되네 요전에도 같은 일 있어서 어플을 삭제하고 재다 온 했더니 한번 이체가 되고 그 이후에 또 안됩니다 이체가 필요할 때마다 다시 어플을 받는 건 너무 비효율적인 것 같은데요
4386,4,KB 스타뱅킹 이용할 때 불편한 점은 이체할 때 계좌번호 복사해서 필요 없는 글씨 지우려 하면 부분적으로 지워지지 않고 필요한 숫자까지 지워져서 많이 불편해요 이 점 꼭 수정해주시면 감사하겠습니다 
4388,3,조금씩 개선되고 있어 보입니다
4395,4,전체적으로 깔끔하긴 한데 초기화면 중앙에는 많이 쓰는 메뉴를 배치함이 좋을듯하네요 이를테면 계좌조회 이체 등 메뉴 배치하면 좋을듯합니다
4405,3,로그인하고 메인화면을 계좌가 있는 화면으로 했으면 좋을 것 같아요
4406,4,이전보다 많이 편해진 게 느껴져요 앞으로도 잘 부탁드립니다
4409,3,사용하긴 편해요 그런데 증권 부동산 등의 앱이 다 나누어져 있어서 하나로 통합되면 좋겠습니다
4417,4,잘 쓰고 있어요 첫 화면 편집 기능 추가해주세요 제일 원하는 건 물론 대출금리 인하입니다 
4418,4,사용하고 있는데 안정적이라고 생각하네요 앞으로도 계속 잘 운영해주세요 오래 사용하고 싶어요 수고하세요
4420,4,지문 로그인이나 금융상품 조회 및 관리는 편하고 좋습니다 리브 앱과 통합되면 더 좋을 것 같습니다 이벤트 페이지에 더 간단하게 들어갈 수 있으면 좋겠습니다
4421,4,패턴을 통해 입장하는 것은 좋음 그러나 팝업이 먼저 뜨고 메인 화면을 좀 더 단순화하면 좋을 듯
4423,3,로딩 속도가 조금 더 빨라졌으면 좋겠네요
4425,4,타은행 계좌를 모두 이용할 수 있는 편리함이 있긴 한데 송금 시 앱 화면이 좀 더 눈에 쏙 들어오게 심플 했으면 좋겠어요
4427,2,팝업 창의 글씨체도 이쁘게 해주세요 첫 화면이 너무 지저분해요 보험 퇴직연금 등은 왜 있는 건가요 국민은행 앱인데 첫 화면 은행 앱에 충실해주세요 그리고 평수라는 캐릭터를 갖고 왔음에도 앱은 반듯반듯 고딕체 너무 올드하게 느껴집니다
4434,4,주 거래가 아니라 적금용으로 사용해서 사용빈도는 높지 않지만 큰 불편사항 속도 오류 없이 잘 사용하고 있습니다 하지만 뭐 좀 보려면 다른 어플을 깔라고 하는데 굳이 줄줄이 소시지처럼 어플 개수가 많을 필요가 있나 싶네요
4438,3,제발 앱 좀 통합해주세요 갈 따지 쳤어요
4440,3,주거래 은행이고 오랫동안 써와서 계속 사용하는 어플 스타뱅킹 리브 등등 어플이 너무 다양해서 모두 설치해서 사용하는 건 꺼려지네요 통합해서 사용할 수 있으면 좋을 것 같아요 또 이벤트가 가독성이 떨어지는데 배치나 폰트 등을 개선해서 가독성을 향상시키면 좋을 것 같습니다
4443,4,많은 기능이 있으나 분류가 잘 안돼서 찾기 어렵네요 국민은행은 앱 종류도 많고 서비스는 좋으나 하나의 통합 플랫폼으로 시너지를 발뤼하면 더 좋겠습니다
4444,4,국민은행만 주거래은행으로 쓰는 사람으로서 기능은 바랄게 없지만 리브 메이트처럼 그날 그날의 이벤트가 있으면 좋겠습니다
4445,4,좋아요 근데 kb 앱이 너무 많아서 통합시켜줬으면 좋겠어요
4447,4,다른 은행 어플보다 보기 편리합니다 모바일 적금도 설명이 잘 되어있고 업데이트 이후 송금하는 것도 편리해지고 주거래은행이 국민은행이라 좋아요 하나 아쉬운 점은 리브 이런 국민은행 관련 어플을 줄여서 하나로 합치면 좋을 것 같습니다
4449,4,어플이 다양한 게 장점이자 단점이에요 하나에 통합하면 좋겠어요
4456,4,다른 은행들과 달리 이용하기 편리하게 돼있고 직관적인 점을 장점으로 뽑지만 한가지 아쉬운 건 어플의 최적화가 잘 안 돼있는 건지는 모르겠지만 버퍼링이 가끔씩 걸리는 거만 개선되면 좋을 것 같습니다
4459,4,사용자 중심이지만 좀 더 긴박한 기능도 필요
4461,4,카톡을 통해 이벤트를 클릭하면 로그인 페이지가 나오고 로그인 후 바로 해당 이벤트가 열리는 게 아니라 이벤트 메뉴로 가서 직접 찾아야 하는데 이 부분이 개선되면 좋겠습니다
4466,4,kb국민은행 스타뱅킹 빠른 업무처리 좋습니다 하지만 너무 많은 앱이 있어서 통합 시켜주시면 더 좋은 정보 활용이 좋을 거 같아요 할 때마다 앱 열려서 다른 것은 안 하게 되네요
4467,4,어려움 없이 불편함 없이 잘 사용하고 있어요 검색란에 메모 말고 예금주로 검색해서 송금했던 계좌번호 쉽게 찾을 수 있으면 좋겠어요
4475,3,처음 로그인할 때 패턴이나 지문 로그인 1달 정도 하면 쿠키 꼬여서 어플을 삭제해야만 해요 개선 부탁드려요
4476,4,뭔가 찾으려면 복잡하다 기능 정리하면 좋겠다 사람들이 자주 쓰는 기능을 앞에 두고 덜 쓰는 건 분류 잘해서 뒤에 두고  못 찾는 거 검색해도 안 나오는 게 많다 검색 기능도 강화하면 좋겠다
4490,4,간편 인증서를 통한 빠른 로그인을 할 수 있어 편리하고 오픈뱅킹을 통해 타은행과 연계시켜 이체나 조회에 있어 편리합니다 다만 아쉬운 점은 입금내역 따로 출금 내역 따로 조회할 수 있으면 좋겠습니다
4492,4,타앱에 비에 기독성이 좋고 메뉴도 한눈에 들어와서 좋습니다 이전에 로그인해도 튕겨서 재접속해야 하는 경우가 몇 번 있었는데 금년에는 개선된 것 같습니다 앞으로도 많이 발전시켜주세요 감사합니다
4511,4,kb 스타 드림 서비스 메뉴가 바로 보였으면 좋겠어요
4522,1,지금 한 달 가까이 비번 대소문자 인식이 개판입니다 오늘 비번 바꾸면 며칠 지나서 또 대소문자가 틀리다고 가입이 안됩니다 그리고 비번 찾기 나서 대문자 고정으로 잡혀있는 건 아시나요 대기업 은행 어플이 몇 주째 개선이 없는지 모르겠습니다 이 정도로 관리 안 하면 모바일 편의를 위해서라도 타은행으로 넘어갈까 고민 중입니다
4523,4,앱 설정이 깔끔합니다 글씨체가 좀 더 고급스럽고 나이대에 맞는 글씨 크기가 조절되었으면 좋겠습니다
4524,4,무난해요 타행계좌까지 한눈에 관리할 수 있어 좋아요 직관적이라 헤맬 일이 적어요 근데 상품 추천에 접근이 용이하면 좋겠어요
4526,4,사용하는데 딱히 문제가 없음 단 지문인증으로 로그인 형식을 바꿀 때 알뜰폰 사용자는 안되는 거 같네요 그리고 이벤트 목록을 잘 보이는 곳으로 화면 배치해줬으면 좋겠네요
4536,4,빠른 이체 조회 금융업무를 쉽게 이용할 수 있어 편하고 좋습니다 단 이벤트 참여나 참여 후 확인 루트를 찾기가 번거로움이 단점이라 생각하는데 지금처럼 팝업 활용으로 이루어짐 좋겠습니다
4538,4,검색어 입력란에도 검색 메뉴가 많이 나오지도 않는 걸 봐서 메뉴 정리를 지금보다 더 세부적으로 만들었으면 좋겠네요 그거 외엔 사용하기는 편리합니다
4544,4,쉽게 사용하기 좋아요 화면상에 후 계좌 바꾸기 설정이 바로 되면 좋겠어요
4550,4,대출 심사 및 서류 제출과 관련한 일련의 절차가 비대면으로 진행하기에 복잡하고 번거롭고 에러가 잦은 현상 등이 특히 타 경쟁사에 비해 부족한 부분 개선 필요
4563,4,잘 사용하고 있어요 같은 kb 계열회사와 앱 호환이 조금 더 가능하면 좋겠어요 그리고 국민은 앱이 너무 세분화되어서 앱을 너무 많이 다운로드해야 하는 것 같기도 해요
4568,4,사용성이 점점 편리해지고 있네요 UX의 개선 효과가 눈에 보입니다
4572,4,인증에 걸리는 속도가 여전히 느립니다 로딩 속도 개선에 힘써주세요
4578,4,내가 선택한 계좌번호를 선택하여 이체한 후 다시 계속 이체할 때 출금계좌가 바뀌어 있어 확인하지 않고 이체 시 원하지 않는 통장에서 돈이 빠져나가는 경우가 있으니 기본 출금계좌가 정해져 있어 특별히 계좌를 바꾸지 않는 한 그 기본계좌에서 이체가 가능하면 좋겠습니다
4581,4,계좌별 확인 가능하고 입체 등록 등등하기 편해서 좋아요 국민은행 전체 통합 앱이 나오면 정말 더 좋겠어요 리브 메이트 리브 스타뱅킹 KB 페이 등등 카테고리가 비슷해서 그런지 뭔가 헷갈리기도 해요
4582,4,이전보다 깔끔해지고 사용자 접근성이 나아진 것 같습니다 아쉬운 건 속도는 개선이 많이 되진 않는 것 같습니다
4588,4,국민은행 스타뱅킹 어플을 가장 많이 사용하고 있는데 조금 아쉬운 부분은 글씨 크기를 크게 보기 하는 기능 추가가 있었으면 좋겠고 펀드 부분도 조금 더 사용자가 이해하기 쉽게 입금내역이라든지 펀드에 어떤 주식들로 구성되어있는지 보고 찾기 쉽게 업데이트해주셨으면 합니다
4603,4,어플 편리하고 좋아요 앱이 깔끔해서 한눈에 정리가 됩니다 다만 약간 아쉬운 건 패턴 로그인하는데 로딩 시간이 너무 길어요 급하게 이체 필요할 때 당황한 적이 꽤 있네요 이 부분만 개선되면 완벽할 것 같습니다
4610,4,지문 로그인 패턴 로그인 업데이트해주세요 로그인했는데 로그인이 안 돼 있어요
4627,4,불편한 점이 몇 가지 있어요 이체할 때 금액을 입력한 후 키판이 없어지질 않아서 위에 올라가서 다른 걸 눌러야 없어져요 개선해 주시면 감사하겠습니다
4628,4,항상 편하게 쓰고 있는 국민은행 어플이에요 어플이 좋아서 국민은행을 씁니다 더 좋아졌으면 좋겠어요
4630,4,타행 인증서 등록을 누르고 아이디까지 입력 후 핸드폰 인증을 마쳤는데 제 이름이 아닌 마지막 글자만 다른 이름이 뜨며 해당인 증서가 없다고 나옵니다 오류 수정 부탁합니다
4631,4,국민은행 어플을 예전부터 사용했는데 점점 사용하기 편리하게 업그레이드되고 있네요 여러 은행 어플을 사용하고 있지만 비교했을 때 좋은 점은 찾아 들어가지 않고 첫 화면에 계좌를 한눈에 볼 수 있다는 점과 주로 이체를 많이 하는 저는 빠른 이체메뉴가 바로 보여서 좋다는 점입니다 아쉬운 점은 입출금 내역 하나하나에 메모하기 기능이 있으면 좋을 것 같아요 입금자명 출금계좌만 가지고 기억하기 힘들어 입금 출금 항목을 기록하려고 타은행에서 잘 이용하고 있는 기능이거든요 그리고 제안하고 싶은 점은 파생되는 어플이 너무 많아서 통합했으면 합니다 앞으로도 발전하길 응원할게요 파이팅입니다
4632,4,사용하기 불편하지는 않습니다만 디자인이 좀 네임밸류를 못 따라간다고 해야 하나요 조금 더 세련되면 좋겠습니다
4647,4,오류 나지도 않고 실제 사용하는 것에는 불만이 없는데 메인 화면에 너무 많은 것을 담으려고 하는 듯합니다 좀 더 심플했으면 좋겠습니다
4656,4,다양한 정보도 많고 편리하기는 한데 속도가 좀 더 빨랐으면 좋겠어요
4661,4,다 좋은데요 로그인 시 패턴의 위치를 하단으로 해주시면 더 좋을 거 같습니다
4663,4,줘 은행이라서 잘 쓰고 있어요 하지만 조금 더 간편해줬으면 좋겠네요
4667,4,다 괜찮은데 가끔 로그인 풀리면서 입력된 지문인증도 날아가는 거만 고치면 좋을 거 같아요
4669,3,오랫동안 사용하던 은행이라 습관적으로 사용하고 있습니다 예적금이나 대출 등 상품에 대한 소개가 앱 전면에 눈에 띄지 않고 하위 카테고리로 찾아가야 하는 점이 좀 개선되었으면 합니다 감사합니다
4679,3,kb국민은행을 약 15년째 주거래은행으로 계속 사용하고 있습니다 스타뱅킹 어플도 편리해서 자주 사용하고 있습니다 다만 몇 가지 아쉬운 점들이 있어 글을 남깁니다 우선 지문 설정을 해놨는데 일정 금액이 넘어가면 보완 카드 번호를 입력해야 하는 점 너무 불편하네요 그냥 지문으로 바로 처리할 수 있도록 수정 부탁드립니다 또한 비대면으로 통장을 개설하게 해 놓고 막상 통장을 해지하려고 하면 영업점을 방문해야 합니다 영업점 방문 시간이 없어 어플로 통장을 개설했는데 해지는 영업점 방문이라뇨 일반 저축은행들 어플에서도 가능한 것을 국민은행에서 이렇게 해 놓으니 이해도 안 되고 너무 불편합니다 한도 제한 계좌 푸는 것도 은행 방문 말고 전용 어플 만들든지 해서 사진 첨부 등으로 해결할 수 있었으면 좋겠습니다 1등 은행 이런 것 광고하지 말고 이런 작은 부분들이나 보완했으면 좋겠습니다 작은 은행들도 실시하고 있는 부분이니 이런 점들 참고해 주십시오
4681,4,인터페이스 사용이 편하지가 않습니다 칼뱅처럼 직관적으로 사용이 가능하도록 개발 부탁드려요
4683,3,오래전부터 사용하던 거라 익숙하게 사용함 단지 페이나 그 같이 이체 시 좀 편했음 더 좋을 것 같음
4693,3,관련 앱이 너무 많아요 통합 좀 해주세요 최소로 정리한 게 4개예요
4706,4,설치나 실행 시 문제없이 수월했고 다른 은행 사이트 대비 가독성이 좋다 이벤트가 좀 더 다양해졌으면 좋겠다
4707,4,국민카드가 주 사용카드고 국민은행이 주거래은행이에요 자주 사용하는 어플인데 스타뱅킹에서 내 카드 사용 현황도 확인할 수 있으면 좋겠어요 이벤트 진행해서 리뷰 안 남기는 편인데 일부로 찾아와서 글 남겨요 고객의 의견을 들으려는 이벤트도 하니 좋네요 더욱 발전하는 앱이 되길 바라요
4708,4,점점 발전은 하고 있으나 좀 더 개선이 필요한 점이 많아요 신한 sol처럼 입출금 알림 앱을 통합하는 걸 고려해보셨으면 합니다
4711,3,사용하기 편리하여 아주 잘 사용하고 있어요 그런데 글자 크기 조절이 가능하면 더 좋을듯해요 눈이 안 좋은 분들은 글씨 크기가 작을 수도 있을 거 같아요 그리고 그런 조절할 수 있는 거를 잘 설명을 부탁드려요
4716,4,프로그램이 조금 더 가벼웠으면 좋겠고 비슷비슷한 앱들이 많은 것 같아요가 능하면 직관적으로 기능을 한두 곳에 모으면 좋겠습니다
4725,4,kb국민은행과 kb 국민카드 리브 메이트 리브 리브 똑똑 kb 페이 등등 비슷한 앱들을 다 따로 설치해야 해서 불편하다 간편을 위해 좀 모으고 잘 정리했으면 좋겠다 그것만 제외하면 만족스러운 편이다
4728,4,간편 로그인으로 편하게 로그인해 바로 통장 잔액 확인 및 이체할 수 있어 간편합니다 다만 kb 국민은행 관련 어플이 너무 많고 잘게 세분화되어 있어서 오히려 이 어플 저 어플 다 다운로드하고 뭐 하나 하려면 각기 다른 어플로 접속해야 하는 점이 불편합니다 불필요한 어플은 정리하고 하나씩 통합해주셨으면 합니다
4731,4,제가 나이가 많은데도 조회나 이체하기 편리하게 만들어졌습니다 어플 사용 시 오류도 작고요 앞으로도 유용한 기능 많이 업데이트 부탁드릴게요
4734,2,이체한 후 엄청 버벅 버벅 사용하기 편하기는 한데 락이라고 해야 히니 아무튼 버벅임만 좀 개선되었으면 좋겠어요
4736,4,필요한 항목을 찾는 게 복잡한 편임 로그인 절차가 다른 은행에 비해 어려움
4739,4,좋아요 입출금 알림도 되면 더 좋을 듯요
4750,4,메뉴 구성이 편리하게 되어있어 사용하기 좋습니다 페이지 로딩 속도가 계속해서 개선되었으면 좋겠습니다
4753,3,주거래 은행이라 자동이체나 급여통장 이라던가 다 연결은 되어 있으나 솔직히 칼뱅이 인터페이스라던가 사용하는 게 더 간편하고 이체도 그냥 토스 이용하게 되네요 접속 방법이라던가 이용 편의성 그리고 인터페이스도 조금 바뀌었으면 좋겠어요
4754,4,인터페이스도 좋고 만족스럽습니다 다만 어플 좀 그만 만들었으면 좋겠어요 남들은 줄여나가는데 어째서 국민은행 어플은 날로 늘어갈까요
4757,4,국민은행 이미지답게 깔끔하고 편리해서 잘 사용하고 있어요 홈 화면에서 새 소식 이벤트란을 다른 챕터로 나누면 더 보기 좋을 거 같아요 그동안 사용하면서 이벤트 창이 하단에 있는 줄 몰라 오른 편 상단을 눌러 사용했었어요
4759,3,가끔 지문인증 로그인 오류가 떠서 그건 좀 아쉽습니다 그것만 빼면 해당 어플 자체는 쓰는덴 불편한 점은 딱히 없어요 그리고 kb가 주거래은행이라 쓰고는 있지만 제발 어플을 하나로 묶어주셨으면 좋겠어요 너무 불편합니다
4763,4,워낙 주거래은행이라 자주 사용하기도 했고 오픈뱅킹 서비스 이후엔 더더 애용하네요 에러 난 적도 없고 사용도 쉬워요 폰 바꿀 때마다 또 깔아도 적응 좋아요 친구들끼리 밥이나 음료를 사 먹고 n 빵을 할 일이 많은데 주로 폰뱅킹을 이용해서 돈은 주고받고 합니다 그런데 이때 저는 카카오페이나 카카오뱅크 토스 등을 주로 이용하고 국민은행 앱을 사용하여 송금하지는 않습니다 사실 처음에는 국민은행 앱을 종종 이용하였지만 쓰면 쓸수록 뭐 때문인지는 모르겠는데 송금할 때 다른 앱보다 더 시간이 걸리는 느낌이 들어서 사용하지 않는 거 같습니다 다양한 앱을 체험해보는 기회도 필요하지만 기능을 분산하는 것 때문에 불편하긴 해요 폰 용량 문제도 있고요
4768,4,앱 사용 시 첫 지문 로그인 후에 제가 자주 사용하는 메뉴가 나와있으면 좋겠어요
