,comment
1985,계좌 개설 중 신분증 촬영만 20분은 한 것 같네요 계속 인식이 안돼서 포기합니다 오기로 어두운 배경 다른 브라우저 다 해봤는데 소용없네요 하다 하다 성질나서 리뷰 남기러 어플 다운로드합니다 다른 금융기관들 모바일로 이용을 해봐도 이렇게 인식이 안되는 곳은 처음이네요 타 경쟁사보다 인지도가 낮은 건 이런 소소한 것들 하나하나 쌓여 그런 것 아닐까요 12달 된 업체도 아니고 금융을 제공하는 업체가 기본적인 서비스 제공도 못하는데 뭘 믿고 이용하라는 건지 배짱이 대단하네요 금융이라면 신뢰와 기본이 충실해야 하는 것 아닌가요 일부 기관들 독점 개설 채널 없어지면 과연 얼마나 사람들이 이용 곳을 이용할지가 궁금하네요
1986,다운로드 안되고 뭔가 불편함
1987,일시적오류인가요 왜 안 들어가지지
1988,앱 실행도 안되고 상담원 연결도 안 되는데 빨리 처리해주세요
1989,굿 좋아요
1990,외국인은 왜 계자 개설 안 되나요
1991,사진 보여줄 테니까 뭔지 알려줘요
1992,앱 깔고 나서 폰이 주기적으로 하얀 화면과 동시에 1초 정도 튕기는듯한 현상이 발생하는데 다른 거랑 출동 나는지 확인해주세요
1993,쓰레기임 신분증 재확인한다더니 한참이 지나도 안 해줌 거지 같은 은행
1994,편하게 사용
1995,케이뱅크 어플이 먹통입니다 아무것도 없는 하얀 바탕화면 이거나 온통 검은색으로 먹통입니다 다른 은행처럼 잘 좀 만들어 보세요 정말 잘 되는 은행 NH 나 우리은행도 있는데 케이뱅크는 어플 만든 업체가 부실 한가 봅니다 온통 하얀색이거나 검은색 바탕화면에서 더 이상 진행이 안됩니다 아무런 메시지도 없어요 어플 제작 업체를 바꿔 보세요
1996,계설 중에 간편 비밀번호가 기억이 안 나는데 비밀번호 찾는 방법은 없나요
1997,직장인 간편 인증 행정 정보 조회 중이라는데 계속 오류 뜨고 뭐 하는 거죠 이에 아니 뭐 매번 불만사항밖에 안 생기네요 이 어플
1998,계좌 개설 중 제 실면 주민번호 폰 번호 맞게 적었는데 계속 인증 실패라고 하네요
1999,거지 같네 가입 다하고 앱 깔았더니 해외폰이라 유심 인증이 안된다네 에라
2000,3월 13일에 계좌 만들다 신분증 없어서 못 만들고 오늘 다시 만들라니깐 13일에 만들었다고 지금 못 만든다 하고 만들어졌다는 계좌 확인할라니 설정한 적도 없는 간편 비밀번호 눌리라는데 어쩌라는 겁니까
2001,실행하면 네트워크 오류 반복  지우고 다시 설치 로그인하려는데 가입 절차로 시작  재실행 후 로그인 정상  앱 종료 후 잠시 뒤 다시 실행  오류 메시지 없이 바로 앱이 닫히는 증상 발생 프로그램 평을 보아하니 댓글로 오류 메시지 정확히 알려달라는데 이 정도 오류 많은 프로그램이면 개발자 가족 친인척만 사용해도 오류에 대한 피드백 자주 받을 것 같습니다 케이뱅크라는 프로그램이 편의성을 추구하는 건 줄 알았는데 귀찮게 하는군요 사용자가 베타테스터 도 아니고 물론 다른 금융 어플들 많이 쓰지만 이렇게까지 오류 뿜는 건 처음 봅니다
2002,계좌개설 추가 인증 단계에서 주민등록증 촬영으로 인증하려고 했지만 실수로 통화 인증을 눌렀는데 이후 다시는 민증으로 인증하지 못하게 고객 대기 순번만 뜨네요
2003,케이뱅크 회원가입 시 기기 인증을 받아야 할 수 있다는데 간편 비밀번호 6글자 입력하라고 합니다 근데 간편 비밀번호 등록한 적도 없고 등록되지 않은 비밀번호라고 하네요 왜 안되는 거죠
2004,창이 안 열려요
2005,어플이 안 열리네요 이용도 못하게
2006,진짜 머리 아따 둔 건지 신분증 인증할 때 사진 말고 직접 입력 기능도 있어야죠  정보 다 입력해두고 시간 좀 10분 정도 지나니까 다시 첨부터 하라네 귀찮게
2007,네트워크 문제라며 몇 시간째 불통이네요
2008,어플 실행이 안 된다 비번 누르고 화면 안 떠서 지우고 다시 깔았는데 이젠 비번도 안 뜨네
2009,킷캣 사용자는 못쓰나요 현재 442입니다 최소 사용 가능한 안드로이드 버전을 알려주세요
2010,아니 인증 다했는데 또 신분증 인증 필요하데서 또 했는데 직원 확인 후 된다면서 언제까지 기다리라는 거야
2011,가입해놓고 사용을 안 해서 비밀번호 기억이 안 나는데 어떻게 찾을 수 있나요
2012,통장 만들 때 시간 업무시간 피해서 8시에 예약하고 기다리고 있는데 안 오다가 10시에 전화 와서 업무 중이라 못 받았습니다 문자가 오는데 예약한 시간대에 연락 줬는데 못 받았다고 거짓말을 당당히 보내네요 진행은 앱에서 다시 해야 하고 시간 약속 못 지킬 거면 예약시간 선택 창에서 제외하세요
2013,별 하나도 아까운 어플 만들고 장사하시네  기기 인증하라는데 설정하지도 않은 비번 6자리 입력만 요구하고 고객센터 1522 1000번은 없는 번호라고 나오고 대단한 은행입니다
2014,계좌개설 중인데 신분증 빛반사도 아니고 잘못 찍은 것도 아닌데 왜 자꾸 오류가 나죠 점검 중인 건가요 20210318 1600
2015,외국 국적은 안되네요
2016,계좌가 안 만들어져요 22일에나 만들 수 있다고 나오네요
2017,요즘 들어 갑자기 모바일앱에서 케이뱅크를 들어가려면 케이뱅크 로고만 나오고 프로그램이 동작하지 않는데 왜 그러는지요
2018,개 하자 있는 은행 지점도 없는 게 은행이라고 까부네  그거도 카카오뱅크나 돼야 인정이나 해줄까 듣도 보도 못한 찌꺼기 은행 KB 은행을 따라 한 걸까 카카오뱅크를 따라 한 걸까 쓰레기 어플 목에 칼이 들어와도 안 씀
2019,지금 입금하고 케이뱅크 비번 확인하고 들어가는데 화면이 바뀌지 않아요 업데이트도 하였는데 안되네요
2020,오늘 왜 로그인하고 나서 시작 화면이 뜨지 않는 거죠 이런 적 한 번도 없었는데 시작이 안됩니다 삭제하고 다시 깔아도 마찬가지예요
2021,안 열림
2022,개구리다
2023,수수료 없는 1금융권 은행 이체할 때마다 수수료 1천 원 들던데 왜 수수료 없다고 광고해요
2024,입출금이 바로 알림이 안 뜨고 한참 있다가 알림이 와서 들어가서 한 번 더 확인해야 되고 엄청 불편합니다
2025,쓰레기네요 유심이 장착되어있는데 국내 유심이 없다고 계속 나와 진행이 안되네요
2026,가입하려고 하는데 가입돼있다고 하네요 가입한 적이 없는데 간편 비밀번호 설정한 적이 없는데 어떻게 해야 하나요
2027,처음 만드는 데 있는 정보라고 안되네요
2028,예수님 부활하셔서 예수님 때문에 좋으니 앞으로 더 발전되길 기대합니다
2029,앱이 정말 불편하고 불안정해요 계좌개설 후에 영상 통화로 인증하려는데 앱 불안정으로 세 번이나 다시 해야 한다는 소리를 듣고 그냥 계좌 해지 탈퇴했어요 인터넷 뱅크의 앱이 이런 식이면 아무리 혜택이 좋아도 안 써요 시간 낭비만 한 시간 함
2030,편의성이 좋아요
2031,케이뱅크 신규 가입 회원입니다 너무 속상해 올립니다 제가 특수상황인지 모르지만 1 컴 화면상 공동 인증서 로그인이 되지 않습니다 2필요한 회원가입 계좌 등록 신분증 모바일 OTP 등록을 다한 후에도 계좌 이체가 되질 않습니다 이틀 동안 이를 해결하려 해도 전혀 진척이 없습니다 이틀 동안 계좌 이체를 단 1원도 하지 못해 속 끓습니다 3컴퓨터로 이체 진행시 OTP 모바일 인증 시 스마트폰의 푸시 메시지가 안 뜹니다 이건 NH 뱅킹 앱에 들어가서 폰 우상단 세 줄 누르고 인증 등록 들어가서 OTP 발행 누르니 해결되더군요 참고로 공인인증서 범용 등록했고요 농협 이용합니다 내일 농협 문의해서 계좌이체 안 되면 전 거래 안 하려고요 다른 분들도 이글 보시고 심사숙고하시길
2032,계좌 만든지 한 달도 안 된 거 같은데 장기 미확인 고객이라고 사용하고 싶으면 평일 업무시간에 연락하래  왜 평점이 낮은지 알만한 듯
2033,편하고 좋네요
2034,그냥 구더기임 신분증 재확인하래서 다시 하려고 사진 찍었는데 그다음 페이지로 절대 안 넘어감 사진만 한 50번 찍은 듯 고객센터 문의해도 그냥 문자에 보낸 링크 타서 하라는데 가서 해도 똑같음 로그아웃 팝업도 없어서 뭐 나가지도 못함 솔직히 비트코인 아니었으면 금방 망할 은행임  어휴 별 한 개도 아깝다
2035,비밀번호를 이따위로 여러 가지 만들라고 하면 뭐가 뭔지 모르게 되어서 불편할 거란 생각은 못 한 건지 안 한 건지
2036,12년간 문제없이 잘 사용했는데 요즘 들어 계속 튕겨서 어플에 접속이 안되네요 삭제하고 재설치해도 똑같습니다
2037,설치했는데 어플은 왜 안 깔릴까요  폰 아무리 뒤져도 안 보이네요
2038,타행계좌로 계좌 이체하려고 하는데 마지막에 비밀번호 누르는 게 계속 안되네요 계속 안돼서 비밀번호 재설정 하려고 했는데 그것도 안되고 공인인증서 등록도 안되고 비밀번호 관련한 건 키판 자체가 뜨지 않아서 어떻게 해야 할지 모르겠어요 좀 그렇네요
2039,폰을 바꿨는데 설치한 200개 넘는 앱 중에서 딱 케이뱅크 앱만 유일하게 유심 인식이 안된다면서 국내에서 구입한 유심이 아니라면 실행이 불가능하다는 메시지가 나옵니다 알뜰통신사 유심인데 앱 재설치하고 유심 뺐다 켜도 안됩니다 뭐 어떻게 하라는 건지
2040,계좌 인증 실패 입력한 계좌번호가 유효하지 않다고 계속 뜨는데 왜 그럴까요 앱을 제거했다가 다시 진행하는데도 그러네요
2041,2월 19일에 계좌 개설하고 체크카드 신청했습니다 3월 15일에 카드 배송이 시작되었다고 카톡이 날라오더군요 정말 빠르기도 해라
2042,앱 가입하려는데 다른 거 잘 되다가 자택 부속 주소 틀리다고 뜨면서 가입이 안됨 인터넷으로 가입하려고 하니 앱으로 만 가입 가능하다 해서 다시 시도해도 안됨 11자 탁 부속 주소 틀림 이것만 뜨고 더 이상 진행이 안돼서 일 망침
2043,아니 이용약관에서 10분째 안 넘어갑니다 핸드폰 껐다 켜도 먹통이네요
2044,추가 인증에서 번호 4자리 입력이 전혀 안됩니다
2045,다운이 안되고 자꾸 대기 중이라 떠요 뭐가 잘못된 거죠
2046,아니 뭐 이따위야 계좌 만들다가 간편 비밀번호 등록 안 해서 다시 하려고 하니까 그걸 입력해야 들어갈 수 있고 껐다 키니까 나중에 계좌개설하라 그러고 간편 비밀번호는 도대체 왜 막아놓은 건데
2047,설치가 안됨
2048,이체하려고 앱 키니까 들어가지지도 않고 거래를 할 수 있게 해줘야지 급할 때 통장에서 돈을 못 찾게 만들었네
2049,최악의 은행 어플입니다 계좌이체하는데 키패드로 계좌번호를 가려서 계좌번호를 확인 못해서 이체를 못하네요 카카오뱅크라도 베끼세요 다른 메뉴도 복잡해서 보기 어려워요
2050,비대면으로 신분증 촬영하야 가입하는데 명의도용될까 늘 부담감이 있어요
2051,예전에 케이뱅크 이용했던 고객입니다 핸드폰 번호가 바뀌었는데 재접속하려니 예전 폰 번호가 나와 번호 변경 불가 접속이 안됩니다 그리고 새로운 계좌를 만들려고 해도 기존 유심에 문제가 있다고 나오네요 국내 제품이며 kt 알뜰폰 유심 사용 중입니다 케이뱅크 이용을 다시 하려고 하오니 확인 후 조치 부탁드립니다
2052,Bad
2053,2020년 발급된 면허증 인식 아무리 해도 안됨 햇빛 피하고 형광등 피하고 어두운 데서도 해보고 여기저기 해봐도 계속 빛반사 심하다고 에러 나고 결국 영상통화 화면으로 넘어가는데 십분요 기다린 끝에 통화했더니 신분증 인식 안 되면 통화로 도와줄 수 없다고 함 어쩌라는 건지
2054,어플 화면이 잘 안 넘어갑니다 은행 어플이 이렇게 안정성이 떨어지면 되겠습니까 넣어놓은 자산들이 걱정되어 조만간 상품 해약할까 고민입니다
2055,군인이라 카메라가 막혀있어 민증 인증을 못해 계좌개설을 못합니다 카메라를 이용한 방법이 아닌 다른 방법도 있었으면 좋겠습니다
2056,휴대폰으로 돈을 입금하잖아요 그러면 다른 은행에서 돈이 빠져나가나요 제가 처음 사용해서 그러는데요
2057,고객확인 제도 이거 뜨면서 로그인이 안 되는데 어쩌란 말입니까 보안 문제 보안 중요하지요 근데 뭐 때문에 이게 저한테만 뜹니까 그리고 이용자가 빠른 조치를 할 수 있게 만들어야 되지 않습니까 다른 인증 방법은 없고 무조건 고객센터 전화하라고 딸랑 있는 것도 모자라 고객센터 전화하면 쳐 받지도 않고 급한 일 처리해야 되는데 일처리 못해서 망했습니다 화가 끝까지 치밀어 올라 다신 사용 안 하겠습니다 해결 빨리해주십시오
2058,구려요
2059,계좌 만드는 중에 신분증 없어서 뒤로 가기했는데 무슨 간편 비밀번호 설정도 안 했는데 하라고 하고 다시 계좌 만들려고 하니 2주 있다가 개설 가능하다고 하네요 이런 경우에 방안을 만들어야지 무조건적으로 못 만들게 하는 건 무슨 의도인지 모르겠어요 좀 고쳐주세요
2060,잘 쓰고 있어요 농협 말고 딴 증권계좌도 연계할 수 있으면 더 좋겠네요
2061,다른 앱 확인이 필요해서 계좌번호 및 인증용 이동하고 돌아오면 먹통이 되고 종료 후 재실행하면 앱 자체 실행이 안됩니다 재설치해도 동일하고요
2062,깔끔히네요
2063,갤럭시S8 쓰는데 케이뱅크 로고만 보이고 접속이 안돼요 해결해주세요
2064,포크 폰인 데 왜 안 돼 오 은행 주식앶 잘 되는구먼 먼 국내 USIM이 아니라 거 하디
2065,앱이 화면에 없어요 
2066,얼마 전 부모님 보이스피싱 사기에 통장이 임의로 만들어지고 이용됨 개설도 쉽고 비대면인 만큼 악용될 소지도 큼 은행 측에 경찰에 자료 제출 필요 자료 요청을 하였으나 그 내역조차도 피해자가 직접 조치해야 한다는 대답만 돌아옴 부디 이런 피해자가 더 없길 바랍니다
2067,신분증 인증하라고 해서 인증 10번도 넘게 했는데 계속 거절당하네요
2068,저도 간편 비밀번호가 일치하지 않는다고만 뜨고 재설정을 눌러도 가입도 중엔 안된다며 처음 화면으로 다시 돌아가기만 하니까 너무 짜증 니나네요
2069,좋아요
2070,사진인식이 안됨
2071,계좌 개설이 바로 안되네요 3월 29일 이후에나 된다고 뜨는데 왜 그런가요 최근 20일 내에 타게 좌 개설한 적은 없습니다
2072,앱이 접속이 안되는데  저만 그런 간가요
2073,앱이 너무 자주 에러가 나요 몇 달째 이래서 답답해서 리뷰 남깁니다 완전히 앱도 종료해봤고 핸드폰도 껐다 키는 걸 반복해도 여전히 실행이 안되네요
2074,통장 계좌 인증을 하려고 하는데 진행하면 이미 개설된 계좌가 있다고 하는데 확인은 어디서 해야 하나요 계좌 인증이 안돼서요
2075,가입도 중 현제 기기 인증하라고 나오는데 비일 번호 설 정도 한 적 없는데 인증번호 6자리 다르다고 나오고 계좌개설 중간저장 중이라고 하니 이거 뭐 사용이나 하겠어요 사용해본 적도 없지만 사용 안 하는 게 좋을 듯 금융 어플 중 최악이네요 별 1개도 아까움
2076,카카오뱅크 보고 배워야 될 듯 진짜 까다롭고 사용하기 불편한 정신 차리라
2077,반년 째 사용 중인데 아직까진 단점은 발견되지 않았고 확실히 기존 은행들 어플보단 복잡하지 않고 시각적으로 보는 거랑 찾는 게 너무 편함 군더더기 없이 깔끔한 게 맘에 들어서 기존에 가지고 있던 은행보다 더 많이 쓰게 됨 더욱 발전하시길
2078,핸드폰에서 로딩 화면에서 안 넘어가네요 어플을 실행하면 하얀 바탕화면에 케이뱅크 K 이 로고만 뜨고 아무리 기다려봐도 화면이 넘어가질 않아요 어제부터인 거 같은데 그제는 됐는데 왜 그런가요
2079,왜 업비트는 이딴거만연동되냐 돈 좀 빼자 욕 쳐 나오게 하네
2080,001003 기기 인증 에러 자꾸 왜 뜨나요 로그인을 할 수가 없네
2081,왜 내 휴대폰은 유심 휴대폰 번호를 인식 못 한다고 계좌도 못 만들까요  헬로모바일 kt 회선인데
2082,케이뱅크에 들어갔는데 단말기에 악성코드 뭐 때문에 튕기는데 이거 악성코드 제거하는 법 좀 알려주세요 알약 이런 거 다 했는데 안되더라고요
2083,기기 인증하기가 안됩니다 간편 비밀번호 설정한 적이 없는데 다시 설정하려면 회원가입 중에는 안된다 합니다
2084,악성코드 왜 나온 거예요
2085,굿
2086,계좌 개설하고 대출한도 조회했더니 신용점수가 400점이 내려갔습니다  짜증 나서 계좌 없애야겠네요 별 한 개도 주기 싫네요
2087,첫 화면에서 안 넘어갑니다 아휴  이틀째임 안고 침
2088,토스랑 카드 내역 열람 제휴 좀 하세요 여기서도 연동되고 저기서도 되는 게 쓰기 편해 자주 찾는 은행이지 결국 상품 팔아 돈 버는 거면서 왜 인색한가요 참고로 오픈뱅킹 케이뱅크로 쓰고 있음 다만 카드 지출 통합조회는 토스가 좋을 뿐인데
2089,그다지
2090,좋아요
2091,짜증 나‥
2092,햄버거 사 먹는 것도 버거워하는 노년기에 앱으로 금융 거래를 한다는 것이 조금은 힘들지 않을까 하고 우려를 했는데 그건 기우였네요 온라인뱅킹에서 공인 인증서 설치하는 것보다 간편하고 쉬운 것을 왜 이제서야 알았을까요  코로나 19로 인해 외출이 쉽지 않은 중장년들에게 적극 추천합니다
2093,빙시 새끼들 로그인 안 된다니깐 계속 똑같은 말만 되풀이함
2094,평점 때문에 걱정했는데 전 잘 되네요 기능 편하고 좋아요
2095,오픈뱅킹 은행별로 보여주는 게 한눈에 잘 들어오고 점점 발전하는 듯 사용하기도 편해요 이체거래도 쉽네요 b
2096,가입 하기에서 휴대폰 인증이 안되네요 제명의 휴대폰인데 지금 제 폰 번호를 전에 사용하던 사람이 케이뱅크를 썼는지 모르겠지만 본인 확인이 안된다고 뜨네요
2097,쓰레기 왜 만듦
2098,계좌 만들기에서 신분증 촬영이 정말 화가 나게 돼있습니다
2099,제발 신분증 촬영에 대해 개선 좀 해주세요 가입 시에도 빛반사 및 홀로그램 반사 없어도 인식률 떨어지고 타은행 및 경쟁사는 그렇지 않던데요 신분증 촬영하는 프로그램만 교체해도 평점 올라갈 겁니다 내부적으로 해당 부분 인식하고 있겠지만 알고만 있으시면 안 돼요 신분증 촬영 때마다 고객센터로 연락해도 직원들도 도와주려고 하지만 형식적인 멘트뿐이고 도움받을 수는 없잖아요 반드시 개선이 필요합니다 장기적으로 생각하셔야 돼요
2100,앱 다운 시 앱 생성이 안됩니다
2101,아주 좋아요
2102,매우 유용한 어플이네요 다른 은행 어플보다 간편하고 여러 절차도 간소화되어 있고 사용하기 정말 좋네요
2103,가입도 편하고 사용하기 편해요
2104,쓸수록 괜찮은 은행
2105,사용하기 편리하고 빠르네요 역시 인터넷은행이 앱은 진짜 잘 만드는 것 같네요
2106,뭡니까 도대체 루팅 됐다고 자꾸 재설치 요구가
2107,아니 동네 마트 알바 모아놨나 도대체 같은 말을 몇 번을 하게 만드는 건데 문자로 영통한다 해서 눌러서 들어갔다고 네 번이나 기어들어가서 인증했다고 말귀를 못 알아먹는 거가 핀번호를 입력해야 영통 넘어가는데 왜 핀번호를 못 가르쳐 준다고 자꾸 엉뚱한 소리만 하는지와 사람 속 뒤집어 지내 손절이다 이거
2108,쓰레기 같은 편의성
2109,답 없는 쓰레기 앱 업비트만 아니면 절대 안 썼음
2110,아니 왜 자꾸 실행 안돼요  돈도 못 빼게
2111,업비트 강제 계좌개설 개화 나네 이따위로 돈 벌고 싶냐
2112,초창기부터 사용 중인데 업비트 연결돼서 더 좋네요 갑자기 사람 몰려서 오류가 많은 가본 데 화이팅임다전 잘 쓰고 있음요
2113,믿고 쓰는 중 3년 넘게 주 거래로 사용 중이네요 처음에는 네이버 카드가 귀여워서 쓴 은행인데 쓸수록 맘에 듭니다 어플도 깔끔하고 앱이 사용하기 너무 쉬워서 주 거래로 잘 사용 중입니다 처음보다 업그레이드된 버전이 훨씬 편하네요 이것저것 여러 상품도 생기고 플러스 박스도 생기고 오픈뱅킹도 넘보기 좋아요 어쩜 이리 사용하기 편한지 점점 더 성장하는 모습이 보기 좋습니다 앞으로도 흥하시길 바랍니다 아 그리고 개인적으로 그룹 계좌 같은 게 생겼으면 좋겠어요 모임용 계좌 같은 거로 사용하게요 건의해봅니다
2114,업데이트 이후 사용이 편해졌어요
2115,오픈뱅킹 좋아 사용했는데 금리 좋아 사용합니다
2116,고객센터 설명도 답답하고 업비트만 아니었음 절대 절대 이용 안 했을 은행입니다 하
2117,굿 오픈뱅킹 편해요
2118,good
2119,잘 되던 카드 페이북 포함 사용 시 상단의 푸시 알림이 안 오는 오류 좀 수정해주세요 알림 설정은 그대로라 잘못된 게 없고 저번에 업데이트를 해봐도 똑같네요 어쩌다 한번 올 때도 있지만 거의 대부분 푸시 알림이 안 와요
2120,계좌개설 단계에서 휴대폰 인증번호가 안 옵니다 몇 번이나 어플 재설치 및 휴대폰 전원 다시 켜 기해도 안됩니다 통신사 문제는 아닌데 방법이 있을까요;;
2121,가입 다해서 돈 넣어놨는데 갑자기 신분증 재검사해야 한다고 로그인 안 시켜주고 하루 종일 검사하고 있음 내 돈 언제 못 빼게 하는 건가요
2122,최근 20일 이내에 계좌를 개설한 적이 없는데 이것 때문에 322일까지 케이뱅크 계좌 계설이 안됩니다 어떻게 해야 하죠
2123,지원하지 않는 os라는데 apk 어디서 못 구하나요
2124,앱이 안 들어가지면 어쩌라는 거야 업데이트 백그라운드 종료 후 재실행해도 안됨
2125,음 적금통장 만들어도 계좌개설이 제한되는 거예요
2126,케이뱅크는 예약 이체가 안 되는지요 아무리 찾아봐도 예약 이체는 찾아볼 수가 없습니다 타은행은 어플이나 홈페이지에 예약 이체를 할 수가 있는데 케이뱅크는 왜 안 되는지요
2127,최고예요
2128,굿 좋아요
2129,대포통장 근절 그거 때문에 못 만드네 케이뱅크 계좌개설한 적이 없는데 다른 데서 만들었다고 계좌 없는 은행이 안 만들어진다고 돼있는 건 좀 
2130,괜찮습니다
2131,앱 먹통 됨 시작할 때부터 기대 많이 하고 썼는데 이제 카카오뱅크으로 넘어갑니다 너무 느리고 오류가 많아서 도무지 은행 앱이라고 믿을 수가 없네요
2132,사람 가지고 장난치는 은행 신분증을 3번 보내주고 화상 통화까지 했는데도 신분증 다시 보내라 함 우리같이 보안 관련된 회사 다니는 사람은 가입하다 속 터짐
2133,참 이런 쓰레기 같은 어플 찾기도 힘들겠네요 본인인증을 몇 번을 하라는지 문자 몇십 통이 와도 처리는 안되고 가입 중이라면서 간편 비밀번호 설정도 안되고 다시 처음으로 가서 본인인증하고 무한 반복 이딴 쓰레기 어플 이용 안 할랍니다
2134,왜 이 시간에도 어플이 안되는지 해명해야 할 것입니다
2135,업비트 
2136,다 좋은데 금액 입력하는 부분이랑 계좌번호 입력하는 부분 터치 인식이 너무 안돼요 개선 좀 빨리 부탁드려요
2137,수수료 없고 1금융권이면 뭐 하나요 어플 작동도 안 되고 계속 첫 화면에서 무한 로딩 걸리고 정작 이체하거나 필요한 순간에 쓸 수가 없는데요 빨리 좀 고쳐주세요 케이뱅크 업데이트 백그라운드 앱 제거하고 실행해도 똑같아요
2138,무슨 신분증이 안 보인데 눈이 없으신가요 입금했는 게 거래정지시켜버리네 추가 거래정지 말고 입금 취소는 왜 안 해요
2139,그럭저럭
2140,앱이 첫 화면에서 이동 안 하다가 응답 안 한다며 닫혀요  왜 이러는 건가요;;;
2141,인증번호 안 와요
