,comment
1486,간편 비밀번호 까먹었는데 재설정도 회원가입 중이라 안 된다고 그러고  어떻게 해야 해요
1487,비대면 계좌개설할 때 현재 카메라를 쓸 수 없는 환경이어서 신분증 촬영을 못하는데 혹시 다른 방법으로 인증할 수 있을까요 사진 파일을 보낸다든지 여권사진으로 인증한다든지
1488,비번 입력에서 오류가
1489,케이뱅크 계좌 만들려는데 기기 인증 보안 비번 계속 나오는데 첨 만드는데 왜 나오나요 기기 인증하라고 계속 핸드폰에 뜨고 아니 처음 가입했는데 6자리가 왜 나오나요 컴퓨터로 하려니 앱으로 회원가입하라고 나오고 로그인 화면에서는 회원가입도 안되고 어떻게 하는 건가요
1490,갤럭시s20인데 왜 어플이 안 들어가지죠
1491,업비트에서 계좌 인증을 하는데 먼저 신청 중인 계좌 인증 중이라고 잠시 후 다시 신청하라는데 계속 안돼요 이게 무슨 말이죠
1492,본인인증이 안됩니다 WC로고M MCRT0032 계좌 만든 적이 없는데 대포계좌를 만들 수 있어서 1달 뒤에 계좌개설 가능하다고 뜹니다
1493,아니 무슨 신분증 확인을 또 하라 그래 짜증 나게
1494,왜 내 리뷰가 없어졌지 회원가입 중에 오류가 생겼는지 비밀번호를 만들지도 않았는데 비밀번호를 치라 그러고 비밀번호 재등록하려고 하면 회원가입 중에는 재등록할 수 없다 그러고 내 이름으로 계좌는 만들어 놓았는지 회원가입을 처음부터 다시 할 수도 없고 어찌어찌해서 타행 인증까지 가도 입력창에 커서가 안 떠서 인증번호 입력이 안된다 그래서 전 단계로 돌아가면 다시 처음으로 돌아가져서 있지도 않은 비밀번호를 쳐야 함 비밀번호가 없는데 재등록도 못 하고 회원가입도 못 하고 인증번호도 못 치고 도대체가 뭘 할 수 없는 앱임
1495,비밀번호를 변경하려고 하는데 들어가는 창이 없어요 상담도 안돼요
1496,통장 개설한 적이 없는데 4월 15일 날 개설이 되었다고 20일 뒤에 다시 하라고 떠요 혹시 몰라 계좌 있는 거 내용 들어가 보니 기기 인증 까지되고 비번은 당연히 모르니 뭔가 싶어요 확인 부탁합니다
1497,인증번호를 10번 시도했는데 안 오네 와 진짜 너무하네 이게 은행 부끄러운 줄 아세요
1498,기기 인증하라는데 간편 비밀번호 등록한 적도 없습니다 하라는 데로 본인 정보 삭제하고 하라는데 본인 정보 삭제 칸도 없어요 무작정 다시 한 달 기다렸다 계좌 만들라는데 도대체 어떻게 해야 됩니까 비밀번호 재설정도 안되고 본인 정보 삭제 칸도 없고 미쳐버리겠습니다
1499,케이뱅크 계좌 개설 시 민증을 준비 못 해서 나중에 하려고 방치해뒀다가 다시 하려니 계속 대포통장 근절한다면서 20일 동안 못 만들게 하는데 벌써 1달이 넘어가는데 어찌 된 건지 확인 좀 가입을 못하고 있네요
1500,안 그가 짐 멈춰요
1501,좋아요
1502,입금할 땐 잘도 되더니 입금확인은 왜 며칠째 안되는 건지 고객센터도 톡 문의도 안되고 재가입하라고만 해대고 열 뻗쳐 죽겠네 앱을 삭제하려 해도 출금을 할 수 없으니 답변 좀 주쇼
1503,오늘 왜 오전부터 앱에 들어가지도 않고 전화연결도 안 되고 앱 채팅으로 하니 앱이 안 열리니 되지도 않고 다시 깔아도 안되고 업무를 봐야 하는데 지금까지 해결이 안 되면 어떻게 하라는 건지 모르겠네요
1504,급격한 성장에 경영을 제대로 못하는 스타트업 문제를 가진 회사 기본적인 cs 응대 케파도 제대로 못 갖춘 회사라 고객센터 연결은 그냥 포기해야 됨
1505,진짜 상담사도 불친절하고 고객 연결 예약을 몇 번을 해야 하는지 일단 신뢰에 대한 문제가 많은 것 같네요 예약시간을 도대체 왜 정해놓는 건지 모르겠네요 
1506,앱이 실행이 안 됨
1507,한국서 케이뱅크 가입 후 외국서 사용하려니 유심 오류 뜹니다 해결 방법은 어떻게 되나요
1508,별 하나도 아까움
1509,신분증 확인 완료했는데 20분 뒤 또 인증하라는 건 뭔지;;;;;; 당황스럽네요
1510,편리하고 일처리가 빠르다
1511,실행이 안돼요
1512,이거 진짜 은행인가요 아니 어떻게 이렇게 허술할 수 있죠 한도제 한은 또 뭐고 아 진짜 괜히 만들어서 다른 은행도 못 만들고 정말 최악이네요 맨날 오류 나고 불안해서 이용 못하겠어요
1513,아 앱이 안 들어가지네 출금해야 되는데
1514,휴대전화를 인식할 수 없습니다 UIS로고M을 재 장착해 주시기 바랍니다라는 메시지가 뜨는데 알뜰폰이라서 그런가요 kt로고M 알뜰폰이고 국내에서 구입한 유심인데 왜 안 되나요
1515,아침부터 접속하려 하나 하얀 화면에 케이뱅크 로고만 뜨고 접속이 안됩니다 급하게 송금하려는데 이런 현상이 30분째인데 해결 방안 마련해 주세요  있는 돈도 못 빼고 있습니다
1516,분명 다른 곳에서 사용한 적도 없고 바이오 인증 변경한 적도 없는데 재등록하라고 나와요 다시 민증사진도 찍어가며 인증했는데 처음부터 다시 재등록하래요 혹여 해킹이라도 당해서 유출당하면 어쩌나 불안하여 삭제하고 재설치했어요 엄청 찝찝해요 그리고 예금 예치하려고 여기 고객센터 문의했는데 엄청 무시하고 깔보는 듯한 태도로 설명하는데 진짜 짜증 났어요 그래서 다른 곳에 예치했어요 진심 너무 화나더라고요
1517,별 하나도 아깝다 설치가 안 됩니다 설치가 이럴 거면 왜 하라는 건지
1518,인증번호 요청 후 인증번호가 안 떠요 어떻게 된 건가요 짜증이 실실 실
1519,쓰레기 같은 앱 업비트 아니었으면 안 썼음
1520,계좌 만들려고 하는데 전화번호 인식 못 하는 건 뭐 어쩌라는 거냐
1521,별로
1522,역대 최악의 어플 신분증 인증을 어떻게 하면 수십 번 해도 안되지
1523,이렇게 신뢰가 없는지 상담원 연결을 해야 한 데서 익일 날 예약상담하면 상담원도 여유가 있을듯해서 남겼더니 예상된 시간보다 한 시간이 지나도 전화 한 통 없고 이 자 연체하면 칼같이 전화하겠지 약속 다 펑크 나고  시간 다 버리고 어휴
1524,굿
1525,최근 3개월 입출금 내역 팩스 전송 좀 해달라니까 그것도 3번이나 잘못 보내서 은행 업무 계속 스트레스받게 합니다 고객센터 한번 전화하려면 기본 1시간 매달려야 하고요 전화상담 예약해도 제시간에 절대 전화 안 줍니다
1526,업비트 하지 마세요 케이뱅크가 최악입니다
1527,왜 평점이 이렇게 낮나 했더니 회원가입조차 불가능함 신분증 사진을 몇 번을 찍었는데 인증이 불가능함 언제 가능해요
1528,설치는 되었는데 계좌개설이 안됩니다 본인인증만 10번을 했습니다
1529,안되고 있어요 첫 하얀 바탕에 로고만 보이고 안됩니다 돈 입금 출금 급한 상황인데 안되면 어쩌자는 건가요
1530,어제 앱 설치 후 계좌개설이 아예 안 되네요 인증 요청해도 인증번호가 안 날라와요 왜 이런 건가요
1531,앱이 열리지 않아요 이체하려는데 답답하네요
1532,계좌개설하고 기기 인증하라는데 비밀번호를 설정한 적이 없는데 계속 비밀번호를 입력하라고 뜨고 비밀번호 재설정 누르면 회원가입 중에는 비밀번호 재설정이 불가하다고 처음으로 돌아가는데 와 돌아버리겠네 무한 루프에 걸려서 10분을 날렸네
1533,새벽 2시 넘어서 접속 안됨 왜 이리 멈춤
1534,아니 처음에 계좌개설할 로고 했는데 인증 한번 했는데 이미 가입되어 있다고 한 달 후에 만들라고 하고  하지만 처음 만드는 건데 날짜도 당일 날짜에 만들었다고 해서 어쨌든 이미 계좌 찾기 해서 인증했는데 무슨 제가 설정도 안 한 간편 비밀번호에서 못 넘어가는 중입니다 간편 비밀번호 바꿀 로고 해도 회원가입 중에는 못 바꾼다고만 하고 하 빠른 해결 좀 요
1535,기기 인증하기 하면 간편 비밀번호 누르라고 하고 간편 비밀번호 누르면 틀렸다고 합니다 간편 비밀번호 등록한 적이 없는데 하고 싶은 비밀번호를 누르면 비밀번호 정보가 없대요 아래 비밀번호 수정하기 누르면 회원가입 중에는 비밀번호 재등록이 안된다네요 통장 개설은 됐다고 하는데 신분증 찍는 화면도 안 나오고 된 건지 안된 건지 기기 인증에서 막혔어요 너무나 답답합니다 어떻게 해야 해결할 수 있을까요
1536,사진촬영 좀 지금 몇 번째입니까
1537,설치 안됨 금융 어플인데 똥 쓰레기네
1538,좋아요
1539,일을 하긴 하는 건가요 뭔가를 고치고 답변을 다세요 그 정도 사람들 유입 가지고 앱 접속이 안되는 거면 정말 일을 하나도 안 하나 보네요 앱을 깔고 나서 한 번도 접속된 적이 없고요 앱 말고 인터넷으로 하려고 해도 회원가입은 앱으로 하라고 합니다 정말 이용 안 하고 싶네요
1540,어플이 며칠째 아예 안 열려서 사용도 못 하고 있는데 지금 이 상황에 대해서 케이뱅크 측에서 인지는 하고 계신 건가요 일시적 오류라고 자꾸 같은 답변 다시는데 며칠을 기다려도 똑같으면 이걸 일시적인 오류라고 할 수 있나요
1541,신분증 제출을 몇 번 보내라고 하는 거야 전화 안 되고 톡 안되고 어떻게 진행하라는 거야 업비트 아니면 삭제용인데
1542,프로그램 접속이 안됩니다 사용자 많아 안된다고 해서 아침 7시에 접속해도 안돼요
1543,한도 제한 해제에 필요한 서류 다 보냈지만 거절 고객센터 전화도 안 받아 톡 상담도 않되 내 계좌 내 돈을 찾고자 하는 고객을 잠재적 범죄자 취급하는 이상한 은행 미치겠다
1544,너무 편함
1545,신분증 인식 무엇
1546,고객센터 연결이 하늘의 별 따기네요 전화연결도 안 되고 톡 상담도 안되고 이용하기 매우 불편합니다 통화연결음만 들릴 뿐 상담원은 없는 느낌입니다 상담이 하고 싶은데 방법이 없어요 기본 대기 고객이 7090명이면 심각한 거 아닌가요
1547,왜 이렇게 먹통이에요
1548,네트워크 연결이 원활하지 않다고 뜨네요 업데이트해도  은행 앱이 이렇게 안정성 떨어지면 어떻게 믿고 쓰나요
1549,일주일 넘게 접속이 되질 않고 로딩 화면에서 멈춰 사용을 못 하네요 왜 그러는 거죠
1550,유해한 앱이 감지된다면서 계속 설치 안됩니다 어떻게 해야 할지 해킹 감지 앱이 있다고만 하고 다른 설명이 없어요 어떤 앱을 지워야 하나요 구체적인 앱 설명 부탁해요 ᆢ
1551,신분증 재촬영 안됨
1552,계좌는 개설이 되었는데 인증정보 누르고 간편 비밀번호를 아무리 눌러도 설정도 안되고 다시 설정 누르면 튕김 이러면 개설에 이유가 있나요
1553,편리합니다
1554,말도 안 됩니다 무슨 금융앱이 며칠째 접속이 안된다니요 어떻게 할까요 믿고 맡길 수 있는 겁니까
1555,아니 도대체 업데이트하고 나서 로그인 화면 비밀번호 치거나 그런 거 할 때 먹통 뭡니까 신속하게 오류 안 고치면 카카오뱅크 계좌 쓸랍니다 케이뱅크 안 쓰고
1556,인증번호 자체가 안 오네요 삼성 갤럭시 S9 최신 OS 시간은 오후 8시부터 계속 쭉이요 이런 앱은 처음입니다
1557,케이뱅크 어플 시 실행이 안 열리네요
1558,어플 실행 시 로고 뜨는 첫 화면에서 진행이 안됩니다 제거 후 재설치도 해봤고요
1559,어제 앱을 깔았는데 어제ᆞ오늘 열리지 않네요
1560,접속이 안되고 계속 멈춥니다
1561,신분증 촬영 오류로 인해 10일째 사진만 찍고 있습니다 대책 강구를 위해 고객센터에 전화하면 무슨 통화량이 많아 대기하라고 나오고 해결책 좀 부탁드립니다 업비트만 아니면 케이뱅크 사용할 일 없겠지만 젠장 도와주세요
1562,아니 어제부터 네트워크 연결이 안 된다고 앱이 켜지지가 않아요 카카오뱅크 기업은행 다른 은행은 잘만 켜지는데 지금 케이뱅크만 안 켜집니다 고객센터 연락은 힘들고 어떻게 해결해야 합니까
1563,생체인 증 시 신분증 촬영 후에 계좌 인증 과정에서 계좌 비밀번호를 입력할 수가 없음 입력란을 터치해도 키보드가 안 뜸 타행 인증 시에도 문자로 온 인증번호를 똑같이 입력할 수가 없음 이뭐병 갤럭시s9 안드 10 케이뱅크 현재 버전 비밀번호를 입력할 수가 없음 입력란을 터치해도 키보드가 안 뜸 타행 인증 시에도 문자로 온 인증번호를 똑같이 입력할 수가 없음 이 쉬운 표현을 이해 못 해서 리뷰를 또 써야 하나요 입력란을 선택해도 입력 수단이 안 뜬다고요 진짜 답답 답 기종 안드 버전 앱 버전 다 적었잖아요 시간이 없어서 답변이 어렵나요 하아
1564,굿
1565,왜 네트워크 연결이 안 도나요 하루 종일 돈 많이 벌면 신경 안 쓰나 하루 종일 네트워크 연결 안되고 고객센터 연결 안 되고 거지 같네
1566,인증번호 1234 왜 안되는 건지 빨리 답변 좀 해주시겠어요
1567,오류 이미 개설된 개 좌를 2년만 애 사용하기 위해 로그인 후 완료 후 재사용 신분증 확인 완료 후 거래 목적 확인이 안 되어있다 하여 보니 아예 선택을 할 수가 없다 몇 번 울해도 선택을 할 수 없다 드롭 다운 이 안되어서 선택할 수 없음 안드로이드 10 벨벳 삼성 안
1568,실명 미확인 떠서 돈도 이체도 못하고 어떻게 해야 되나요
1569,아니 케이뱅크가 가장 최근에 설치한 앱인데 케이뱅크를 삭제합니까 팀뷰어 안 깔려있고 블랙 앱이 뭔지 모르겠는데 앱이 몇백 개는 되는데 어떻게 하나씩 다 지워봅니까
1570,it 금융권 대가리에서 나오는 불친절 어플
1571,최악 집 계약하다가 이체 오류 나서 돈 못 줘서 1시간째 계약 못 하고 있음
1572,짱입니다
1573,굿
1574,갑자기 초기 로딩 시 케이뱅크 로고 뜨면서 더 이상 진행이 안됨 이거 때문에 폰 자체가 버벅댐
1575,아니 어플 설치하고 권한 허용 누르니까 하얀 화면에 로고만 떠있길래 기다렸는데 그냥 먹통이 된 거였네요 이어 플로 할 수 있는 거라곤 설치하고 삭제 두 가지밖에 없네요 어쩌라는 거죠
1576,다른 건 모르겠는데 바이오 인증 1회 성으로 바꾸십쇼 겁나 거지 같네요 조금만 변경되면 민증 꺼내서 인증하라고 하니
1577,어쩔 수 없이 엡비트 때문에 사용해봤지만 진심 최악인 듯 출금하려 해도 아주 소액뿐이 안되고 출금 늘리려면 쇼를 해야 하고 대출이나 적금 카드 만들면 출금 늘릴 수 있다 해서 대출 신청 적금 신청 카드 발급까지 다 신청해봤지만 머는 머 땜에 안되고 머 땜에 안되고 아주 생쇼에 스트레스 작렬이네  혹시 관리자가 내 계좌 같은 거 볼 수 있는지 모르겠지만 기존은행 클릭 한두 번으로 신용대출까지 되는데 내 실력과 능력으론 케이뱅크는 감당할 수가 없다  법으로 정해진 건진 몰겠지만 엡비트 때문에 여기 이용하는 사람 많은 거 같은 일일 이체한도 40만 원  코인 투자하는 사람들이 일이십 가지고 보통 투자하나 보죠  비트코인 히나 팔아서 현금화하려면 정확히 6개월 소요되겠네요 대단하십니다
1578,한도 설정이 너무 불편합니다 요새 핸드폰 요금을 종이 고지서로 누가 받나요
1579,점검 후에 접속이 안돼요 하얀 화면에서 앱이 멈춥니다
1580,해외에서 심 카드 잘못되었다고 설치가 안됨
1581,좋아요
1582,앱 자체가 안 들어가지면 돈 어떻게 빼어 쓰나요
1583,급하게 사용할 일이 있어서 켰는데 갑자기 신분증 재확인해야 된다더니 다른 거 아무것도 안됨 다시 제출했는데 확인 안돼서 결국 사용도 못함 은행 앱인데 머 이런 게 다 있죠 최악이네
1584,설치가 안되는데요
1585,개판 중에 상개판 고객센터 존재 의미도 없고 기능도 없고 불편하고 종합세트
1586,이체 상향 힘드네요 하루 100만씩 언제 다 이체 시키나요
1587,진짜 쓰레기 접속도 안됨
1588,업데이트 뭐예요 코드명 BE903 뭐예요 업데이트하고 이상해졓어요 빨리 해결 좀 해부세요 답글 했는데 안돼요 이젠 들어가지지도 않아요 아니 이거 뭔데요 뭐 이딴 어플의 다이어요
1589,휴대폰 카메라가 고장 나서 신분증 인식이 안되는데 계좌개설 방법이 전혀 없나요
1590,인증 문자가 안 오는데 어떡하나요
1591,외국인은 계좌개설 불가인가요
1592,살다 살다 고객센터 30분 동안 연결 안 되는 곳은 처음 보네요 간편 비밀번호 좀 찾을라고 해도 되지도 않고
1593,잘 이용하다가 인증하라고 갑자기 입출금 및 다른 서비스 제한하고 인증을 다시 하라고 하네요 재인증 해도 빨리 확인하는 것도 아니고 엄청 늦게 하고 일처리가 늦어서 답답합니다
1594,아니 계좌 만들려고 휴대폰 본인인증하는데 한 글자 잘못 써서 지우고 다시 쓸라는데 번호 지워지지도 않고 그냥 그대로 있는데 어쩌라는 거임
1595,밤이어서 앱 안 들어가 지나 했는데 그냥 계속 오류네요
1596,업데이트하고 나서 앱이 느려졌네요 어떻게 방법이 없나요
1597,설치를 했는데 폰에 안 깔리네요 어떻게 해야 폰에 깔 수 있나요
1598,기기 인증 비번을 알 수 없는데 알 수 있는 방법이 있나요
1599,며칠 전부터 바이오 정보를 다시 등록하라 더니 신분증 인증이 안되어서 그냥 비밀번호 치고 사용했습니다 오늘 앱 실행시키려 하니 비번 칠 때마다 세션이 만료되었다고 로그인 자체가 안 되네요;;도와주세요
1600,신분증 사진이 연하다고 개설 안 되면 신분증 재발급 해야 하나 그렇게까지
1601,갑자기 앱이 실행되지 않고 있습니다 먹통인데요 앱을 실행하면 화면이 은행 로고만 보이고 전혀 실행되지 않음 업데이트해도 증상이 동일합니다 왜 갑자기 이런 증상이 발생되고 있는지 궁금하고요 어떻게 조치해야 되는지 알려주세요
1602,답변 복사 붙여넣기 하지 말고 오류 수정 똑바로 하세요 해당 계좌에서 이체 못해서 필요할 때 못 써서 피해생기면 어쩌실 건데요 기다렸다 접속하라는데 3일 동안 그렇게 해도 안되면요
1603,아니 도대체 아침 일찍 도 어플이 안 들어 가지고 밤늦게도 안 들어 가지고 오류 안 나게 수정을 하던 해야지 맨날 오류 나서 타이밍 놓치면 책임질 거예요 아니 몇 번을 지웠다 깔아도 들어가긴커녕 핸드폰 자체를 먹통으로 만들어놓고 때려치우던가요
1604,문상 콜라보 이벤트로 만든 계좌는 가상 계좌 전용인가요 주소까지 쳤는데 실물 통장이 안 옴
1605,노트 20 사용자입니다 업데이트 이후 실행이 안 되어 문의했더니 사양과 상세한 오류 상황 스 샷 등을 요구하시네요 아니 뭐 실행이 되어야 스샷을 하던가 하지 하얀 바탕에 로고 나오고 한참 있다가 앱이 중단되었다고 나오는데 결국 몇 번 재설치해서 실행됩니다
1606,케이뱅크 실행이 안 되네요 자꾸 단말기 악성코드로 인해 종료된다고만 하네요
1607,장난하시나요 어플 안 켜지는데요 댓글 보니까 며칠 전부터 그러는 거 같은데 신용으로 먹고사는 은행이 뭐 하자는 건지 모르겠네 앱 정상화되면 돈부터 바로 빼고 계좌 없앨게요
1608,왜 접속이 안되는 겁니까 접속이 돼야 돈을 사용하죠
1609,진짜 가입 오류 짜증 난다 가입도 중 앱이 튕겼는데 계좌는 있다고 나오고 접속은 안되고
1610,신분증 인식 쓰레기임 토스 카카오 다른 것보다 인식 엄청 못해 30분을 전등 키면 밝다 커튼 치면 어둡다 빛이 반사된다 이름이 틀리게 인식됐다 내가 왜 야발 적당한 채도를 찾아야 돼 그냥 카메라로 찍는 게 더 낳겠다 카메라 인식에 50만 원 정도 투자했냐 대학생 조별 과제야 더럽게 못 만드네
1611,안 좋아
1612,앱 로딩 속도 왜 이럼 이게 정상적 조치 취한 거면 더 문제 있는 건데
1613,왜 앱이 안 열리나요 빠른 조치 부탁드립니다 전 삼성 s20눌트라 사용 중입니다
1614,3일째 전화 연결이 안 되네 톡 상담 장난하나 무슨 서비스 관리를 이딴 식으로 하냐
1615,아니 앱 실행이 안됩니다
1616,앱 접속할 수 있는 방법이 뭔가요 제발 알려주세요 상담원 전화도 안 되고 욕 나옵니다 갑자기 왜 안되는 건지
1617,인증 영상통화하다 주겠어요 사람을 늘리던지
1618,정말 별 하나도 아깝네 제대로 될 때가 없음 어휴
1619,신분증 재확인했는데 아직도 안 열려요
1620,이런 쓰레기 앱을 만들어놓고 사용하라는 건가요
1621,답도 안 줘 전화도 안 받아 문의도 안돼 총체적 난국
1622,앱이 먹통이다 짜증 난다
1623,아 왜 접속이 안되냐 무슨 관리를 이따위로 하냐고 객 돈 가지고 장난치는 거도 아니고 내 돈 입출금도 마음대로 안되는 은행이 은행이냐 얼른 실행되게 해 놔라 무슨 운영이 장난이냐
1624,케이뱅크가 응답하지 않음 앱 실행조차 안됩니다 제 계좌 알아서 입금은 했는데 출금은 어찌할까요 10년 만에 열받아서 소리 질렀습니다 당장 해결해주세요
1625,진짜 쓰레기다
1626,신분증 촬영 인증 때려죽여도 안 되네요 인식은 다했으면서 인증 오류라고 계속 떠요
1627,돈 뽑아야 하는데 어떻게 은행 앱이 로그인이 안 되지 앱 실행해도 하얀 화면만 나옴
1628,하라는 대로 해도 안되는데요 돈 좀 뺍시다
1629,맨 첨에 간편 비밀번호를 치고 들어왔는데 장기 미사용 제한 해제하려고 간편 비밀번호 입력할 때 비밀번호가 오류 났다고 함 잘못 눌렀나 싶어서 다시 시도해봤는데도 계속 오류라고 뜸 답답하네요
1630,계좌 개설하는데 비번이 왜 계속 안 맞는다는 건지 모르겠네
1631,아주 편리합니다
1632,인증 문자가 안 와요
1633,한도조회 푸는 것 좀 쉽게 해놔라 이게 뭐냐
1634,어플이 처음 깔았을 때만 켜지고 그다음부터는 접속이 안되네요 몇 번을 다시 깔고 있는지 모르겠네요 후
1635,툭하면 지연에 고객센터 문의 뜨고 왜 그러는 건가요 뱅킹 앱이 이러면 쓰겠습니까
1636,오늘 열리지가 않네 참
1637,계좌 개설하는데 계좌 비밀번호 생성 시 틀리다고 계속 뜨네요 답답하기가 정말
1638,유심칩 인식을 못 해 가입이니 안 됩니다
1639,속도도 느리고 업무처리도 버벅대고 연동된 어플 인증도 느리네요 뭐 어쩔
1640,입출금 왜 이렇게 안 됨
1641,핸드폰에 악성코드가 전혀 없는데 왜 있다면서 계속 튕기나요 어떻게 해야 할까요 기종은 갤럭시 s10 5g입니다
1642,어 후기가 안 좋을만하네요 어디 인디그룹이 만든 앱인 줄 알았음
1643,음 더 써 보고
1644,이체하려고 어플 들어가려는데 로그인이 안 돼서 업데이트 문젠가 해서 업데이트했는데도 튕기고 어플 제거 후 재설치했더니 이제 본인인증도 오류로 안되네요 이렇게 불안하고 불편하게 만들어 놓으면 어떻게 믿고 돈을 맡기죠
1645,복호화 오류 접속 느림 해결 좀 해주세요
1646,겁나 로딩 길고 느리네  돈 벌었으면 서버 증설 좀 해라 좀
1647,입출금 접속 1박2일 속 터진다
1648,기기 인증에서 간편 비밀번호를 입력하라는데 안 되는데요
1649,진짜 처음으로 어플에 리뷰 남겨봅니다 계속 본인 인증 지문을 하라고 하네요 로그인부터 시작해서 이체를 하려고 하는데 본인 인증 몇 번을 한지 모르겠습니다 몇 번을 해도 다음으로 넘어가지 않는 것은 덤이고요 관리 좀 해주세요
1650,어플 로딩이 왜 이렇게 느린가요
1651,지금 접속이 안돼요
1652,아니 상담원들 목소리 한번 듣기 많이 힘드네요 무슨 3일을 계속 전화했는데 새벽까지 무슨 대기 고객이 780명이여 예약상담도 안되고 톡 상담도 어플로만 통해서 가능한 것 같은데 계좌개설조차 지금 안 된다고 하는데 상담은 어디서 받나요 대체
